pharmacyName,town,cordinates,streetAdress,phoneNumber,type
Pharmacie BELHAMRA KHELIFA FETHIA,SOUSSE VILLE,"35.81210404,10.61389",CITE ETTAAMIR SOUSSE SOUSSE VILLE,73234230,DAY
Pharmacie CHEHATA RAOUDHA,SOUSSE VILLE,"35.829245,10.636892",Bd M. MAAROUF - Imm EL HOUDA SOUSSE SOUSSE VILLE,73225284,DAY
Pharmacie DHIDAH MONCEF,SOUSSE VILLE,"35.836417,10.636892",Av KHELIFA KAROUI SOUSSE SOUSSE VILLE,73278546,DAY
Pharmacie KSIA SARRA,SOUSSE VILLE,"35.853826,10.636892",Av DE LA PERLE DU SAHEL SOUSSE SOUSSE VILLE,73244066,DAY
Pharmacie MILED RIADH,SOUSSE VILLE,"35.844367,10.636892","56, Av DU GRAND MAGHREB SOUSSE SOUSSE VILLE",73275011,DAY
Pharmacie SLIM AMEL EP TOUZI,SOUSSE VILLE,"35.837378,10.636892","45, Av ABDELHAMID EL KADHI SOUSSE SOUSSE VILLE",73227071,DAY
Pharmacie ZAIER RAOUDHA,SOUSSE VILLE,"35.831583,10.636892","42, Av MOHAMED KAROUI SOUSSE SOUSSE VILLE",73229457,DAY
Pharmacie BEN SAID KMICHA AMEL,SOUSSE VILLE,"35.839534,10.636892",PLACE DU MAGHREB ARABE SOUSSE SOUSSE VILLE,73223762,DAY
Pharmacie DOUDECH AICHA,SOUSSE VILLE,"35.810582,10.636892",Rue 1 JUIN - TAFFALA SOUSSE SOUSSE VILLE,73237622,DAY
Pharmacie LAMINE KAMEL,SOUSSE VILLE,"35.832253,10.636892",Av HABIB BOURGUIBA SOUSSE SOUSSE VILLE,73210137,DAY
Pharmacie PHARMACIE LES JASMINS (GUITOUNI+KLABI),SOUSSE VILLE,"35.854630,10.636892",Av 14 JANVIER - Imm CESAR SOUSSE SOUSSE VILLE,73275480,DAY
Pharmacie SALEM MOOTAMRI NABIHA,SOUSSE VILLE,"35.823555,10.638064","17, Rue DE MARR - LA MEDINA SOUSSE SOUSSE VILLE",73227045,DAY
Pharmacie SELLAMI MALEK,SOUSSE VILLE,"35.82487975,10.638064",Bd STADE OLYMPIQUE SOUSSE SOUSSE VILLE,73232030,DAY
Pharmacie ZARROUK TAOUFIK,SOUSSE VILLE,"35.830236,10.638064","31, Av DE LA REPUBLIQUE SOUSSE SOUSSE VILLE",73224810,DAY
Pharmacie ZAYATI GONGI BESMA,SOUSSE VILLE,"35.839959,10.638064",Av TAIEB MHIRI - Imm BYBLOS SOUSSE SOUSSE VILLE,73227075,DAY
Pharmacie BEN MEDDEB MOHAMED HABIB,TANTANA,"35.913967,10.638064",Rte TOURISTIQUE - TANTANA SOUSSE TANTANA,73329810,DAY
Pharmacie BECHIKH KHAOULA,THRAYET,"35.75429252610192,10.638064",Rue BASSATINE SOUSSE THRAYET,73387118,DAY
Pharmacie DARDOURI JRAD WISSAL,ZAOUIET SOUSSE,"35.790908,10.638064",Av DE L'ENVIRONNEMENT SOUSSE ZAOUIET SOUSSE,73237225,DAY
Pharmacie HAMDI FAIZA,ZAOUIET SOUSSE,"35.798109,10.638064",Rte EL MOUREDDINE SOUSSE ZAOUIET SOUSSE,73305353,DAY
Pharmacie MEZGHANNI MZABI RAFIAA,ZAOUIET SOUSSE,"35.786966,10.638064",Av DU 14 JANVIER SOUSSE ZAOUIET SOUSSE,73231856,DAY
Pharmacie ZGHIDA RAJA,ZAOUIET SOUSSE,"35.790256,10.619926",Av DU CAIRE - Rte DE MSAKEN SOUSSE ZAOUIET SOUSSE,73334861,DAY
Pharmacie SELMI RABI,KSIBET SOUSSE,"35.777113,10.619926",Av HABIB BOURGUIBA SOUSSE KSIBET SOUSSE,73238495,DAY
Pharmacie FELAH WISSEM,ZAOUIET SOUSSE,"35.782645,10.619926",Av DU 14 JANVIER SOUSSE ZAOUIET SOUSSE,73386888,DAY
Pharmacie BACCOUCHE BECHIR,AKOUDA,"35.865832,10.569202",Av DE LA REPUBLIQUE SOUSSE AKOUDA,73256106,NIGHT
Pharmacie KENANI RAMZI,ENFIDHA,"36.131947,10.569202",Av DE L'ENVIRONNEMENT SOUSSE ENFIDHA,73250412,NIGHT
Pharmacie BLEL SAIDA,EZZOUHOUR,"35.788325,10.569202","107, Av 14 JANVIER SOUSSE EZZOUHOUR",73310504,NIGHT
Pharmacie MEDDEB ABDELHAMID,HAMMAM SOUSSE,"35.856640,10.569202",Rte DE TUNIS SOUSSE HAMMAM SOUSSE,73365457,NIGHT
Pharmacie LEJMI MOHAMED ALI,HERGLA,"36.028330,10.569202",Rue HANNIBAL SOUSSE HERGLA,73251735,NIGHT
Pharmacie SAKKA NAWEL,KALAA EL KEBIRA,"35.869297,10.569202",Rue DU 1er JUIN SOUSSE KALAA EL KEBIRA,73253248,NIGHT
Pharmacie DIMASSI SALMA,KALAA ESSGHIRA,"35.822968,10.569202",Av HABIB BOURGUIBA SOUSSE KALAA ESSGHIRA,73249245,NIGHT
Pharmacie BELHAJ JRAD MOHAMED TAHAR,KONDAR,"35.934788,10.569202",GP 2 SOUSSE KONDAR,73389753,NIGHT
Pharmacie LAHMAR AFEF,KSIBET SOUSSE,"35.774554,10.569202",Av HABIB BOURGUIBA SOUSSE KSIBET SOUSSE,73390340,NIGHT
Pharmacie MASMOUDI MOHAMED SABER,MESSADINE,"35.75789392,10.569202",Av DU 14 JANVIER SOUSSE MESSADINE,73323887,NIGHT
Pharmacie BEN MOUSSA MUSTAPHA,MSAKEN,"35.730303,10.577882",125 Av HABIB BOURGUIBA SOUSSE MSAKEN,73259027,NIGHT
Pharmacie SAKLI ABDALLAH,MSAKEN,"35.73506392,10.577882",Av TAIEB HACHICHA SOUSSE MSAKEN,73261500,NIGHT
Pharmacie BRAHEM MSELMI AIDA,RIADH,"35.808157,10.577882",Rue IBN ABI BALTAA. Imm EL HOUDA SOUSSE RIADH,73307980,NIGHT
Pharmacie BOUHAFA BEN ROMDHANE LAMIA,SIDI BOU ALI,"35.955617,10.577882","33, Av HABIB BOURGUIBA SOUSSE SIDI BOU ALI",73247138,NIGHT
Pharmacie BEN ELHENI IMENE,SIDI EL HENI,"35.681101,10.577882",Rte NATIONALE 12 SOUSSE SIDI EL HENI,73280206,NIGHT
Pharmacie HAMDI LEILA,SOUSSE VILLE,"35.814151,10.577882",Av 15 OCTOBRE SOUSSE SOUSSE VILLE,73232920,NIGHT
Pharmacie KHELIFA NEJI,SOUSSE VILLE,"35.831541,10.577882",38 Av DE LA REPUBLIQUE SOUSSE SOUSSE VILLE,73224795,NIGHT
Pharmacie BEN MEDDEB ABDELLATIF,SOUSSE VILLE,"35.833373,10.577882","11, Rue MOHAMED EL KAROUI SOUSSE SOUSSE VILLE",73228619,NIGHT
Pharmacie DRISS BOUZID DHOUHA,YASMINE HAMMAMET,"36.363257,10.577882",Av DE LA MEDINA SOUSSE YASMINE HAMMAMET,72241242,NIGHT
Pharmacie OUESLATI IMED,ZAOUIET SOUSSE,"35.798200,10.577882",Bd IMAM ABOU HANIFA SOUSSE ZAOUIET SOUSSE,73304917,NIGHT
Pharmacie AMRI  WASSIM,CHATT MERIEM,"35.935297,10.325388",CHOTT MERIEM SOUSSE CHATT MERIEM,31555582,NIGHT
Pharmacie AOUIDJ LATIFA,BORJ LOUZIR,"36.865106,10.202024","15, Av MUSTAPHA MOHSEN ARIANA BORJ LOUZIR",71691906,NIGHT
Pharmacie JALLOULI MASMOUDI HEDIA,ENNASR,"36.855966,10.202024",Av HEDI NOUIRA - Imm EL KHALIL ARIANA ENNASR,71828537,NIGHT
Pharmacie GUIGA MOHAMED ZOUBEIR,ETTADHAMEN,"36.829672,10.202024","8, Av DE L'INDEPENDANCE ARIANA ETTADHAMEN",71546273,NIGHT
Pharmacie BEN YAGHLANE NADHIM,ETTADHAMEN,"36.833679,10.202024","112, Av TAIEB MHIRI ARIANA ETTADHAMEN",70663644,NIGHT
Pharmacie ATTALLAH HAFEDH,INTILAKA,"36.840227,10.202024",Rte DE BIZERTE Km 4 ARIANA INTILAKA,71650862,NIGHT
Pharmacie SOUID ABDELJELIL,KALAAT ANDALOUS,"37.062588,10.202024",Rte DE LA PLAGE ARIANA KALAAT ANDALOUS,71558206,NIGHT
Pharmacie FOURATI SALMA,LA SOUKRA,"36.8644998,10.202024",Av UMA ARIANA LA SOUKRA,70721686,NIGHT
Pharmacie NAJJAR HICHEM,LA SOUKRA,"36.876659,10.202024","63, Av FATTOUMA BOURGUIBA ARIANA LA SOUKRA",70946544,NIGHT
Pharmacie KOTRANE RIADH,RAOUED,"36.879426,10.202024","49, Av FETHI ZOUHEIR ARIANA RAOUED",71866672,NIGHT
Pharmacie SARRAI KARIM,RAOUED,"36.887664,10.202024","116, Av FETHI ZOUHEIR ARIANA RAOUED",71857662,NIGHT
Pharmacie BIBI SALMA,SIDI THABET,"36.909636,10.044214","100, Av HABIB BOURGUIBA ARIANA SIDI THABET",71553219,NIGHT
Pharmacie ZOUARI ABDESSATTAR,AIN ZAGHOUANE,"36.861630,10.276283","92, Av KHALED IBN EL WALID TUNIS AIN ZAGHOUANE",71724336,NIGHT
Pharmacie BOUHAJEB HOSNI,CARTHAGE,"36.841184,10.276283","1, Rue SCIPION TUNIS CARTHAGE",71731228,NIGHT
Pharmacie KOLSI IMED,CITE EL KHADHRA,"36.829930,10.276283","92, Av LOUIS BRAILLE TUNIS CITE EL KHADHRA",71327009,NIGHT
Pharmacie BEN YAHIA MARIEM,EZZOUHOUR,"36.793873,10.276283","32 bis, Rue 4001 TUNIS EZZOUHOUR",71529925,NIGHT
Pharmacie DEBBICHE SOUFIA,IBN KHALDOUN,"36.824810,10.276283","45, Av IBN EL KHATIB TUNIS IBN KHALDOUN",71929842,NIGHT
Pharmacie OUESLATI MOHAMED SALAH,KABBARIA,"36.754745,10.276283","29, Rue 10236 TUNIS KABBARIA",71270727,NIGHT
Pharmacie SADDEM ABDERRAZZAK,LA GOULETTE,"36.829392,10.276283","194, Av HABIB BOURGUIBA TUNIS LA GOULETTE",71720222,NIGHT
Pharmacie BACH HAMBA SFAIHI MAHMOUD,LA MARSA,"36.878606,10.276283","9, Av ALI BELHOUANE TUNIS LA MARSA",71775770,NIGHT
Pharmacie ANNABI GHAIET MOUNA,LA MARSA,"36.886299,10.276283","32, Av TAIEB MHIRI TUNIS LA MARSA",71729811,NIGHT
Pharmacie GUIGA MAHER,BARDO,"36.810395,10.276283","24, Av HABIB BOURGUIBA TUNIS BARDO",71222284,NIGHT
Pharmacie MELIANI BALTI SAIDA,BARDO,"36.813453,10.147052","60, Av HABIB BOUGATFA TUNIS BARDO",71510700,NIGHT
Pharmacie DEBBICHE MOHAMED MONDHER,LE KRAM,"36.834892,10.147052","207, Av HABIB BOURGUIBA TUNIS LE KRAM",71721354,NIGHT
Pharmacie KARRAY ZIED,MANAR,"36.842529,10.147052","24, CENTRE DORRA TUNIS MANAR",71887635,NIGHT
Pharmacie HOUISSA MOHAMED SALAH,SIDI BOU SAID,"36.869246,10.147052","13, Av HABIB BOURGUIBA TUNIS SIDI BOU SAID",71740958,NIGHT
Pharmacie MACHAT HAIFA,SIDI HASSINE,"36.781645,10.147052",Rue 4657 - Rte DE MORNAGUIA TUNIS SIDI HASSINE,71934999,NIGHT
Pharmacie KILANI MARIEM,TUNIS VILLE,"36.790371,10.147052","56, Rue SIDI EL BECHIR TUNIS TUNIS VILLE",71347224,NIGHT
Pharmacie JENAN HOSNIA,TUNIS VILLE,"36.791855,10.147052","44, Av BAB DJEDID TUNIS TUNIS VILLE",71240994,NIGHT
Pharmacie OUAHCHI MUSTAPHA,TUNIS VILLE,"36.805763,10.147052","47, Av ALI BELHOUANE TUNIS TUNIS VILLE",71262600,NIGHT
Pharmacie KARRAY SLIM,TUNIS VILLE,"36.808018,10.147052","20, Av DE LA LIBERTE TUNIS TUNIS VILLE",71253520,NIGHT
Pharmacie BOUBAYA HOUSSEM,TUNIS VILLE,"36.811807,10.165772","21, Av HEDI SAIDI TUNIS TUNIS VILLE",71897768,NIGHT
Pharmacie KHABTHANI RACHED,TUNIS VILLE,"36.800013,10.165772","43, Av H. BOURGUIBA - LE COLISEE TUNIS TUNIS VILLE",71252507,NIGHT
Pharmacie BEN JEMAA LAMIA,CITE MHIRI,"36.859683,10.165772",Rce NARJESS - EL AOUINA TUNIS CITE MHIRI,58399671,NIGHT
Pharmacie BACCOUCHE BECHIR,AKOUDA,"35.865832,10.569202",Av DE LA REPUBLIQUE SOUSSE AKOUDA,73256106,NIGHT
Pharmacie KENANI RAMZI,ENFIDHA,"36.131947,10.569202",Av DE L'ENVIRONNEMENT SOUSSE ENFIDHA,73250412,NIGHT
Pharmacie BLEL SAIDA,EZZOUHOUR,"35.788325,10.569202","107, Av 14 JANVIER SOUSSE EZZOUHOUR",73310504,NIGHT
Pharmacie MEDDEB ABDELHAMID,HAMMAM SOUSSE,"35.856640,10.569202",Rte DE TUNIS SOUSSE HAMMAM SOUSSE,73365457,NIGHT
Pharmacie LEJMI MOHAMED ALI,HERGLA,"36.028330,10.569202",Rue HANNIBAL SOUSSE HERGLA,73251735,NIGHT
Pharmacie SAKKA NAWEL,KALAA EL KEBIRA,"35.869297,10.569202",Rue DU 1er JUIN SOUSSE KALAA EL KEBIRA,73253248,NIGHT
Pharmacie DIMASSI SALMA,KALAA ESSGHIRA,"35.822968,10.569202",Av HABIB BOURGUIBA SOUSSE KALAA ESSGHIRA,73249245,NIGHT
Pharmacie BELHAJ JRAD MOHAMED TAHAR,KONDAR,"35.934788,10.569202",GP 2 SOUSSE KONDAR,73389753,NIGHT
Pharmacie LAHMAR AFEF,KSIBET SOUSSE,"35.774554,10.569202",Av HABIB BOURGUIBA SOUSSE KSIBET SOUSSE,73390340,NIGHT
Pharmacie MASMOUDI MOHAMED SABER,MESSADINE,"35.75789392,10.569202",Av DU 14 JANVIER SOUSSE MESSADINE,73323887,NIGHT
Pharmacie BEN MOUSSA MUSTAPHA,MSAKEN,"35.730303,10.577882",125 Av HABIB BOURGUIBA SOUSSE MSAKEN,73259027,NIGHT
Pharmacie SAKLI ABDALLAH,MSAKEN,"35.73506392,10.577882",Av TAIEB HACHICHA SOUSSE MSAKEN,73261500,NIGHT
Pharmacie BRAHEM MSELMI AIDA,RIADH,"35.808157,10.577882",Rue IBN ABI BALTAA. Imm EL HOUDA SOUSSE RIADH,73307980,NIGHT
Pharmacie BOUHAFA BEN ROMDHANE LAMIA,SIDI BOU ALI,"35.955617,10.577882","33, Av HABIB BOURGUIBA SOUSSE SIDI BOU ALI",73247138,NIGHT
Pharmacie BEN ELHENI IMENE,SIDI EL HENI,"35.681101,10.577882",Rte NATIONALE 12 SOUSSE SIDI EL HENI,73280206,NIGHT
Pharmacie HAMDI LEILA,SOUSSE VILLE,"35.814151,10.577882",Av 15 OCTOBRE SOUSSE SOUSSE VILLE,73232920,NIGHT
Pharmacie KHELIFA NEJI,SOUSSE VILLE,"35.831541,10.577882",38 Av DE LA REPUBLIQUE SOUSSE SOUSSE VILLE,73224795,NIGHT
Pharmacie BEN MEDDEB ABDELLATIF,SOUSSE VILLE,"35.833373,10.577882","11, Rue MOHAMED EL KAROUI SOUSSE SOUSSE VILLE",73228619,NIGHT
Pharmacie DRISS BOUZID DHOUHA,YASMINE HAMMAMET,"36.363257,10.577882",Av DE LA MEDINA SOUSSE YASMINE HAMMAMET,72241242,NIGHT
Pharmacie OUESLATI IMED,ZAOUIET SOUSSE,"35.798200,10.577882",Bd IMAM ABOU HANIFA SOUSSE ZAOUIET SOUSSE,73304917,NIGHT
Pharmacie AMRI  WASSIM,CHATT MERIEM,"35.935297,10.325388",CHOTT MERIEM SOUSSE CHATT MERIEM,31555582,NIGHT
