pharmacyName,town,cordinates,streetAdress,phoneNumber,type
Pharmacie BOUAZIZ HAMMADI,ARIANA VILLE,"36.857636,10.191110",Av 18 JANVIER ARIANA ARIANA VILLE,71717913,DAY
Pharmacie BOUDEN TAOUFIK,ARIANA VILLE,"36.863405,10.191110","24, Av AHMED KHABTHANI ARIANA ARIANA VILLE",71712619,DAY
Pharmacie REZGUI CHARNINE LEILA,ARIANA VILLE,"36.860802,10.191110","27, Rue DE BEYROUT ARIANA ARIANA VILLE",71715991,DAY
Pharmacie FARZA LEILA,ARIANA VILLE,"36.860684,10.191110","66, Av ALI BELHOUANE ARIANA ARIANA VILLE",71710678,DAY
Pharmacie FEKI MOHAMED HABIB,ARIANA VILLE,"36.860900,10.191110",Rue EL QODS (JERUSALEM) ARIANA ARIANA VILLE,71710811,DAY
Pharmacie GHEZAIEL MONCEF,ARIANA VILLE,"36.8591,10.191110","20, Av DE CARTHAGE ARIANA ARIANA VILLE",71714717,DAY
Pharmacie GHROUBI CHAABANE SANA,ARIANA VILLE,"36.855335,10.191110",Rue KEHNA ARIANA ARIANA VILLE,71702790,DAY
Pharmacie ATALLAH EYA,ARIANA VILLE,"36.856960,10.191110",Av MUSTAPHA HJAIEJ - Rce ROSAMISS ARIANA ARIANA VILLE,71719448,DAY
Pharmacie KOBBI INES,ARIANA VILLE,"36.849499,10.191110","35, Av HABIB BOURGUIBA ARIANA ARIANA VILLE",71702102,DAY
Pharmacie AMMAR KRICHEN ZEINEB,ARIANA VILLE,"36.859053,10.191110","44, Av TAIEB MHIRI ARIANA ARIANA VILLE",71714659,DAY
Pharmacie DJAIT ELLOUMI RAJA,ARIANA VILLE,"36.862073,10.187084",Rue ALI BELHOUANE?- Rce LES ROSES ARIANA ARIANA VILLE,71710213,DAY
Pharmacie MARRAKCHI MOALLA CHEDIA,ARIANA VILLE,"36.862090,10.187084","1, Av HEDI KHEFACHA ARIANA ARIANA VILLE",70741085,DAY
Pharmacie MIDOUN NAJJAR MARIEM,ARIANA VILLE,"36.867253,10.187084",Av IBN KHALDOUN ARIANA ARIANA VILLE,70823933,DAY
Pharmacie SAHNOUN RAOUF,ARIANA VILLE,"36.858566,10.187084","15, Av TAIEB MHIRI? ARIANA ARIANA VILLE",71711914,DAY
Pharmacie GHILEB GULSURENE MALEK,BORJ LOUZIR,"36.864730,10.187084","5, Av MUSTAPHA MOHSEN ARIANA BORJ LOUZIR",71692386,DAY
Pharmacie TRIFA KAMMOUN FARIHA,BORJ LOUZIR,"36.866495,10.187084","87, Av de l'UMA ARIANA BORJ LOUZIR",70683569,DAY
Pharmacie OURABI MAJDI,BORJ LOUZIR,"36.876107,10.187084","27, Rue ABDERRAHMEN MAMI ARIANA BORJ LOUZIR",70697626,DAY
Pharmacie BEN HAFAIEDH HASSEN,BORJ LOUZIR,"36.865859,10.187084","11 bis, Rue ABDERRAHMEN MAMI ARIANA BORJ LOUZIR",70689110,DAY
Pharmacie CHAARI HAJER,BORJ LOUZIR,"36.867573,10.187084","75, Av MUSTAPHA MOHSEN ARIANA BORJ LOUZIR",71695380,DAY
Pharmacie JABEUR ABDERRAHMEN,BORJ TOUIL,"36.901077,10.187084",CENTRE GEANT TUNIS CITY ARIANA BORJ TOUIL,70835820,DAY
Pharmacie BEN SLIMANE SEIFEDDINE,CEBALAT BEN AMMAR,"36.913017,10.105492",Rte DE BIZERTE ARIANA CEBALAT BEN AMMAR,71537610,DAY
Pharmacie KCHIR MEMMI MONIA,CHOTRANA,"36.887600,10.105492","111, Av JAWDET EL HAYET ARIANA CHOTRANA",70693059,DAY
Pharmacie BEN YACOUB ABBASSI NABILA,ENNASR,"36.856100,10.105492",Av HEDI NOUIRA ARIANA ENNASR,70830581,DAY
Pharmacie KHABTHANI ILYES,ENNASR,"36.859263,10.105492","125, Av DE L'ERE NOUVELLE ARIANA ENNASR",70039687,DAY
Pharmacie CHEIKHROUHOU BEN MOSBAH JAOUIDA,ENNASR,"36.85676383,10.105492",Av HEDI NOUIRA - Rce GHASSEN ARIANA ENNASR,71828554,DAY
Pharmacie KAMMOUN DHOUIB MOUNIRA,ENNASR,"36.858816,10.105492",Av DE L'ERE NOUVELLE - Rce LES EMERAUDES ARIANA ENNASR,70852909,DAY
Pharmacie FAKER KADDOUR NAJOUA,ENNASR,"36.867535,10.105492",Av HEDI NOUIRA - Imm ISIS ARIANA ENNASR,71818451,DAY
Pharmacie FEKIH ZAGHBIB SONIA,ENNASR,"36.860533,10.105492",Av DE L'ERE NOUVELLE - Rce ERRIADH ARIANA ENNASR,70831080,DAY
Pharmacie KAOUEL JAMELEDDINE,ENNASR,"36.862029,10.105492",Av HEDI NOUIRA - Imm LA COUPOLE ARIANA ENNASR,70851305,DAY
Pharmacie KHABTHANI BERANGERE,ENNASR,"36.858558,10.105492","54, Av H. NOUIRA - Imm NOUR EL HOUDA ARIANA ENNASR",70831781,DAY
Pharmacie SMAOUI KARRAY SALWA,ENNASR,"36.865140,10.168511",Av HEDI NOUIRA - Imm SARAYA ARIANA ENNASR,70852979,DAY
Pharmacie DOUIK TAABOURI RAOUDHA,ETTADHAMEN,"36.824248,10.168511",Av DE L'ENVIRONNEMENT ARIANA ETTADHAMEN,71545964,DAY
Pharmacie JELILI KAIS,ETTADHAMEN,"36.836772,10.168511","293, Rue 105 ARIANA ETTADHAMEN",71546733,DAY
Pharmacie AMARA BEN RHOUMA ZOHRA,ETTADHAMEN,"36.830593,10.168511",Rue TAIEB MHIRI ARIANA ETTADHAMEN,71516453,DAY
Pharmacie BRAIEK ABDELMAJID,ETTADHAMEN,"36.838513,10.168511","533, Rue 105 ARIANA ETTADHAMEN",70663966,DAY
Pharmacie AZZOUZI FERCHICHI RYM,ETTADHAMEN,"36.836207,10.168511","57, Av TAIEB MHIRI ARIANA ETTADHAMEN",71549230,DAY
Pharmacie ZGOLLI FARAH,ETTADHAMEN,"36.827108,10.168511",PLACE DE L'INDEPENDANCE ARIANA ETTADHAMEN,71223674,DAY
Pharmacie BEN ABDELFETTAH WASSIM,ETTADHAMEN,"36.834064,10.168511","35 bis, Rue 105 ARIANA ETTADHAMEN",70663969,DAY
Pharmacie BEN KHEDIJA AMEL,ETTADHAMEN,"36.832567,10.168511",Av TAIEB MHIRI ARIANA ETTADHAMEN,71546982,DAY
Pharmacie GHARBI MEJDI HAJER,ETTADHAMEN,"36.830897,10.168511","68, Av 105 ARIANA ETTADHAMEN",71545064,DAY
Pharmacie HAJJAR FTATI AHLEM,ETTADHAMEN,"36.840037,10.102856",Rue 105 ARIANA ETTADHAMEN,71546029,DAY
Pharmacie SOUABNI MONGI,INTILAKA,"36.834196,10.102856",Rte DE BIZERTE Km 3 ARIANA INTILAKA,71548191,DAY
Pharmacie BARBOUCHE MOHAMED RIDHA,INTILAKA,"36.848461,10.102856",Rte DE BIZERTE Km 5 ARIANA INTILAKA,70563534,DAY
Pharmacie MAKNI MALEK,INTILAKA,"36.840330,10.102856",Rte DE BIZERTE Km 4 ARIANA INTILAKA,71933180,DAY
Pharmacie HAMMI MOHAMED HILEL,INTILAKA,"36.843071,10.102856",Rte DE BIZERTE Km 4? ARIANA INTILAKA,71554325,DAY
Pharmacie TEJ SAFFAR LEILA,INTILAKA,"36.839542,10.102856","16, Av IBN KHALDOUN ARIANA INTILAKA",71544465,DAY
Pharmacie GAMMAR ALI,INTILAKA,"36.857017,10.102856",Rce LES PALMIERS ARIANA INTILAKA,70735230,DAY
Pharmacie TOUINSI NAJLA,INTILAKA,"36.838491,10.102856","52, Av IBN KHALDOUN ARIANA INTILAKA",71544308,DAY
Pharmacie BRAHAM BEN ALAYA FELLA,KALAAT ANDALOUS,"37.062514,10.102856",Av HAMDA ISSAOUI ARIANA KALAAT ANDALOUS,70569101,DAY
Pharmacie AYADI FADHILA,KALAAT ANDALOUS,"37.059016,10.110617","112, Av HABIB BOURGUIBA ARIANA KALAAT ANDALOUS",71558423,DAY
Pharmacie KALAI MOHAMED NEJIB,KALAAT ANDALOUS,"37.061880,10.110617",Rue RAOUDHA? ARIANA KALAAT ANDALOUS,71558167,DAY
Pharmacie DRIDI CHERIF LEILA,LA SOUKRA,"36.873371,10.110617","144, Av DE L'UMA ARIANA LA SOUKRA",70944810,DAY
Pharmacie HASSINE MOHEDDINE,LA SOUKRA,"36.879429,10.110617","53, Av FATOUMA BOURGUIBA ARIANA LA SOUKRA",71868642,DAY
Pharmacie KHALFALLAH FATMA,LA SOUKRA,"36.876102,10.110617",Rte DE CHOTRANA? ARIANA LA SOUKRA,70697394,DAY
Pharmacie BEN AISSA BEN AMMAR CHIRAZ,LA SOUKRA,"36.867080,10.110617","67, Av DAR FADHAL ARIANA LA SOUKRA",71759945,DAY
Pharmacie BEL HADJ HASSINE NAZIHA,LA SOUKRA,"36.864612,10.110617",Av de l'UMA - Imm IMEN ARIANA LA SOUKRA,70683710,DAY
Pharmacie MESSAAD MAALEJ MONIA,LA SOUKRA,"36.869822,10.110617",CITE HEDI NOUIRA - Imm INES ARIANA LA SOUKRA,70697190,DAY
Pharmacie KALAI BAYOUDH RAOUDHA,LA SOUKRA,"36.864076,10.252726",Av DAR FADHAL - Rce ELYES ARIANA LA SOUKRA,70947999,DAY
Pharmacie DRISS MOHAMED,LA SOUKRA,"36.871450,10.252726","29, Av DE LA MOSQUEE ERRAOUDHA ARIANA LA SOUKRA",70682010,DAY
Pharmacie HAMDOUN LARGUECHE NEILA,LA SOUKRA,"36.874970,10.252726","157, Av UMA ARIANA LA SOUKRA",71764052,DAY
Pharmacie ALOULOU AMMAR KHEDIJA,MENZAH,"36.847585,10.252726",CITE JAMIL - MENZAH 6 ARIANA MENZAH,71754731,DAY
Pharmacie BEN CHEIKH BOUBAKER NADIA,MENZAH,"36.848745,10.252726","8, Av D'AFRIQUE - MENZAH 5 ARIANA MENZAH",71234626,DAY
Pharmacie BARGHOUTHI BOUGATEF MOUHIBA,MENZAH,"36.845812,10.252726","151, Av OTHMANE IBN AFFENE - MENZAH 6 ARIANA MENZAH",71231340,DAY
Pharmacie GAAFAR RAJA,MENZAH,"36.848761,10.252726","38, Av DE LA LIBERTE - MENZAH 5 ARIANA MENZAH",71766110,DAY
Pharmacie HANNACHI KHEDIJA,MENZAH,"36.854780,10.252726","15, Av M. IBN ABI SOFIENE - MENZAH 5 ARIANA MENZAH",71235421,DAY
Pharmacie KESRAOUI SOUHEIL,MENZAH,"36.855364,10.252726","48 bis, Av OTHMAN IBN AFFEN - MENZAH 8 ARIANA MENZAH",71700595,DAY
Pharmacie MEDDEB KHROUF RAFIDA,MENZAH,"36.849707,10.252726","12, Av AMMAR IBN YASSER - MENZAH 6 ARIANA MENZAH",71233559,DAY
Pharmacie ABDENNEBI NAKKOURI LILIA,MENZAH,"36.849542,10.17492","14, Av DE LA LIBERTE - MENZAH 5 ARIANA MENZAH",71766218,DAY
Pharmacie KILANI SAMIRA,MENZAH,"36.851597,10.17492","112, Av M. IBN ABI SOFIENE - MENZAH 7 ARIANA MENZAH",71233595,DAY
Pharmacie MHIRI TURKI IKBEL,MENZAH,"36.852628,10.17492",Av MOUAWIA IBN ABI SOFIENE - MENZAH 7 ARIANA MENZAH,71230726,DAY
Pharmacie BCHINI NOUR EL HOUDA,RAOUED,"36.908353,10.17492","136, Rte DE RAOUED ARIANA RAOUED",70687385,DAY
Pharmacie CHEKRI NADHEM,RAOUED,"36.888869,10.17492","128, Av FETHI ZOUHIR ARIANA RAOUED",71856340,DAY
Pharmacie MEDDEB TARDI LEILA,RAOUED,"36.879327,10.17492","11, Rce EL OMRANE 1 ARIANA RAOUED",70935537,DAY
Pharmacie MNIF BEJAR FATMA,RAOUED,"36.891297,10.17492","76, Av HABIB BOURGUIBA ARIANA RAOUED",71756721,DAY
Pharmacie BEN YAHMED BEN HADJ WASSILA,RAOUED,"36.878047,10.17492","35, Av FETHI ZOUHIR ARIANA RAOUED",71763866,DAY
Pharmacie BENNANI MZAH EMNA,RAOUED,"36.904678,10.17492",Rte DE RAOUED ARIANA RAOUED,71878899,DAY
Pharmacie HAMMAMI CYRINE,RAOUED,"36.890223,10.17492","5, Av HABIB BOURGUIBA ARIANA RAOUED",71866172,DAY
Pharmacie OUESLATI NEJIB,RAOUED,"36.900322,10.180579",Rte RAOUED Km 5 ARIANA RAOUED,71866347,DAY
Pharmacie KRIAA NABIL,RAOUED,"36.890403,10.180579","33 bis, Av ARISTOTE ARIANA RAOUED",71757752,DAY
Pharmacie MEDDEB HILA FATMA,RAOUED,"36.881068,10.180579","65, Av FETHI ZOUHIR ARIANA RAOUED",71762559,DAY
Pharmacie AYED JIHENE,RAOUED,"36.941635,10.180579","342, CITE CHAKER ARIANA RAOUED",70684924,DAY
Pharmacie ELOUATI SAMIA,RAOUED,"36.889522,10.180579",Av HABIB BOURGUIBA ARIANA RAOUED,71877939,DAY
Pharmacie HEDFI ROUAHI RADHIA,RAOUED,"36.899780,10.180579","18, Rue H. IBN ABDELMOTTALEB ARIANA RAOUED",71685500,DAY
Pharmacie OUANES KILANI SAMIRA,RAOUED,"36.885128,10.180579","104, Av FETHI ZOUHIR ARIANA RAOUED",71858176,DAY
Pharmacie BELGHITH NOUREDDINE,RAOUED,"36.889831,10.180579","41, Av HABIB BOURGUIBA ARIANA RAOUED",71762001,DAY
Pharmacie HAMMAMI AMMAR IMEN,RAOUED,"36.896988,10.180579","Rte DE RAOUED, Imm GALAXY ARIANA RAOUED",71857169,DAY
Pharmacie MAHFOUDH SOUHIR EP DAGDOUG,RAOUED,"36.884213,10.184108",Av FATHI ZOUHIR ARIANA RAOUED,71763664,DAY
Pharmacie SMIDA HAMZA NEIRA,RAOUED,"36.910330,10.184108",Rte DE RAOUED Km 12 ARIANA RAOUED,71769707,DAY
Pharmacie BEN OTHMAN TAIEB,SIDI THABET,"36.90907405991976,10.184108",Av 14 JANVIER ARIANA SIDI THABET,71552106,DAY
Pharmacie ABDELMOULA AHMED ,ARIANA VILLE,"36.852673,10.184108","71, Av HABIB BOURGUIBA ARIANA ARIANA VILLE",71716297,DAY
Pharmacie AZOUZI NESSIMA EP LANDOULSI,RAOUED,"36.954382,10.184108","Rte PLAGE, KM 10 ARIANA RAOUED",71769248,DAY
Pharmacie MZAH SELIMA,LA SOUKRA,"36.862343,10.184108",Rue CHEIKH ENNEIFER - Rce ZAYATINE ARIANA LA SOUKRA,71758111,DAY
Pharmacie DHOUIB MASMOUDI SANA,INTILAKA,"36.864960,10.117143",Rte DE BIZERTE Km 7 ARIANA INTILAKA,70564555,DAY
Pharmacie ROUISSI BEN NEJIMA SAIDA,AEROPORT,"36.847878,10.217696",AEROPORT TUNIS CARTHAGE TUNIS AEROPORT,71783880,DAY
Pharmacie HAMDI ABDELHAKIM,AIN ZAGHOUANE,"36.855584,10.217696","Rce ESSALEM, JARDINS DE CARTHAGE TUNIS AIN ZAGHOUANE",71667082,DAY
Pharmacie DARGHOUTH DALILA,AIN ZAGHOUANE,"36.861747,10.217696","114, Rue CHEIKH ENNEIFER TUNIS AIN ZAGHOUANE",70736068,DAY
Pharmacie ZNAZEN OLFA,AIN ZAGHOUANE,"36.859654,10.217696","84, Av CARTHAGE TUNIS AIN ZAGHOUANE",36168798,DAY
Pharmacie AMMAR ZIED,AIN ZAGHOUANE,"36.864263,10.217696",Rce L'HORIZON TUNIS AIN ZAGHOUANE,70723833,DAY
Pharmacie BOUSNINA JANFAOUI MAHA,AIN ZAGHOUANE,"36.859108,10.217696",Av K. IBN WALID - Rce DIAR SOUKRA TUNIS AIN ZAGHOUANE,70727260,DAY
Pharmacie BEN BRAHIM NEDRA,AIN ZAGHOUANE,"36.857175,10.217696",Rue OSMAN BAHRI TUNIS AIN ZAGHOUANE,71761967,DAY
Pharmacie PHARMACIE EL WAHAT KHEDER + HELALI,AIN ZAGHOUANE,"36.857691,10.217696",76 Av KHALED IBN EL WALID TUNIS AIN ZAGHOUANE,70855017,DAY
Pharmacie HARZALLAH LOUATI INES,AIN ZAGHOUANE,"36.860587,10.217696",Av K. IBN WALID - Rce FATIMIDE TUNIS AIN ZAGHOUANE,70727452,DAY
Pharmacie BASTI YOUSSEFI LATIFA,BARDO,"36.812725,10.136559","1, Rue FATTOUMA BOURGUIBA TUNIS BARDO",71582581,DAY
Pharmacie BOUATTOUR MOHAMED,BARDO,"36.812990,10.136559","63, Av HABIB BOURGUIBA TUNIS BARDO",71585406,DAY
Pharmacie LAOUITI MOHAMED HEDHILI,BARDO,"36.803559,10.136559","38, Av HEDI CHAKER TUNIS BARDO",71513648,DAY
Pharmacie TURKI MAJED,BARDO,"36.807993,10.136559","129, Bd 20 MARS TUNIS BARDO",71515830,DAY
Pharmacie GHEDIRA MILI LEILA,BARDO,"36.813005,10.136559","24, Av MONGI SLIM TUNIS BARDO",71516039,DAY
Pharmacie MESTIRI AYARI ATEF SOUAD,BARDO,"36.806423,10.136559","1, Rue MUSTAPHA KHRAIEF TUNIS BARDO",71509254,DAY
Pharmacie SOMRANI LARGHECHE SOUAD,BARDO,"36.805458,10.136559","41, Av DE L'INDEPENDANCE TUNIS BARDO",71510308,DAY
Pharmacie ZOUAIDI HASSEN,BARDO,"36.809858,10.136559","5 bis, Av HABIB BOURGUIBA TUNIS BARDO",71221413,DAY
Pharmacie BEN GHACHEM BEN JAAFAR AZZA,BARDO,"36.804810,10.136559",Av DE L'INDEPENDANCE TUNIS BARDO,71512003,DAY
Pharmacie MELLOULI GORGI IMEN,BARDO,"36.808124,10.136559","2, Av HABIB BOURGUIBA TUNIS BARDO",71511795,DAY
Pharmacie NEFZI ZEINEB,BARDO,"36.819573,10.140052",Av HABIB BOUGATFA TUNIS BARDO,71509148,DAY
Pharmacie FERKTAJI MOULDI DALENDA,BARDO,"36.820158,10.140052","3, Rue DE CASABLANCA TUNIS BARDO",71516664,DAY
Pharmacie MBARKI MOHAMED TABRIZI,BARDO,"36.801415,10.140052","62, Rue BAYREM ETTOUSI TUNIS BARDO",71583686,DAY
Pharmacie SKHIRI HAMDANI NABILA,BARDO,"36.809033,10.140052","81, Bd DU 20 MARS TUNIS BARDO",71580111,DAY
Pharmacie ZOUAIDI HOUCINE,BARDO,"36.809251,10.140052",BARDO CENTER TUNIS BARDO,71500050,DAY
Pharmacie GARRAM HATEM,BARDO,"36.811026,10.140052","36, Av HABIB BOUGATFA TUNIS BARDO",71507516,DAY
Pharmacie HAJJAM SLAHEDDINE,BARDO,"36.811747,10.140052","41, Av HABIB BOURGUIBA TUNIS BARDO",71220750,DAY
Pharmacie LARGUECHE LAMIA,BARDO,"36.807073,10.140052",Rue BAYREM ETTOUNSI et Av DE L'INDEPENDANCE TUNIS BARDO,71514330,DAY
Pharmacie ABBASSI BHOURI CAMILIA,BERGES DU LAC I,"36.835541,10.140052",Rue DU LAC DE COME - Rce SIDI MANSOUR TUNIS BERGES DU LAC I,71655260,DAY
Pharmacie AZZOUZ MOHAMED,BERGES DU LAC I,"36.837793,10.140052",Rue TAHAR HADDED - Imm EL HABIB TUNIS BERGES DU LAC I,71964634,DAY
Pharmacie BOUZOUITA MOUFIDA,BERGES DU LAC I,"36.838590,10.238940","1, Rue DU LAC LEMAN TUNIS BERGES DU LAC I",71862805,DAY
Pharmacie BEN CHEIKH BOUBAKER TAREK,BERGES DU LAC I,"36.833122,10.238940",Rue Lac LADOGA et Rue Lac TURKANA TUNIS BERGES DU LAC I,71962363,DAY
Pharmacie KHARRAZ CHELBI MERIEM,BERGES DU LAC I,"36.836529,10.238940",Rue DU LAC MALAREN TUNIS BERGES DU LAC I,71861140,DAY
Pharmacie CHENCHAH BEN HAMZA HEDIA,BERGES DU LAC I,"36.831296,10.238940",PASSAGE DU LAC INARI - Rce DES 2 LACS TUNIS BERGES DU LAC I,71961064,DAY
Pharmacie JAZI SAMIA,BERGES DU LAC I,"36.839524,10.238940",Rue LAC VICTORIA - Rce EL BOUHAIRA TUNIS BERGES DU LAC I,71860040,DAY
Pharmacie FARAH SLIM,BERGES DU LAC II,"36.845474,10.238940",LAC MEDICAL CENTER TUNIS BERGES DU LAC II,71735220,DAY
Pharmacie ESCHADELY SADRI,BERGES DU LAC II,"36.844011,10.238940",Rue FEUILLE D'ERABLE - Imm NESMET EL BOUHAIRA TUNIS BERGES DU LAC II,70039222,DAY
Pharmacie AZZOUZI FERIEL,BERGES DU LAC II,"36.845237,10.238940",Rue FEUILLE D'ERABLE - Imm DREAM TUNIS BERGES DU LAC II,71267132,DAY
Pharmacie SOUAI DHAOU CHELBIA,BERGES DU LAC II,"36.848333,10.238940",Av DE LA BOURSE - Imm MIMOSA TUNIS BERGES DU LAC II,71190007,DAY
Pharmacie BEJI MONIA,CARTHAGE,"36.861536,10.238940","126, Av HABIB BOURGUIBA TUNIS CARTHAGE",71980480,DAY
Pharmacie HENCHIRI MOURAD,CARTHAGE,"36.849871,10.326206",CENTRE COMMERCIAL CARTHAGE DERMECHE TUNIS CARTHAGE,71275683,DAY
Pharmacie HALIOUI MONIA,CARTHAGE,"36.846327,10.326206","8 bis, Av DE L'INDEPENDANCE TUNIS CARTHAGE",71720663,DAY
Pharmacie MASMOUDI MOHAMED WALID,CENTRE URBAIN NORD,"36.848691,10.326206",PROMED BUILDING TUNIS CENTRE URBAIN NORD,71947359,DAY
Pharmacie KAMMOUN NARJES,CENTRE URBAIN NORD,"36.844318,10.326206",Imm MALEK TUNIS CENTRE URBAIN NORD,71948145,DAY
Pharmacie FRINI CHAKER,CENTRE URBAIN NORD,"36.846690,10.326206",Rce NOUR CITY TUNIS CENTRE URBAIN NORD,71949140,DAY
Pharmacie PHARMACIE REKIK,CHARGUIA,"36.833173,10.326206","42, Rue 8600 TUNIS CHARGUIA",71807158,DAY
Pharmacie AJOUA AHMED,CITE EL KHADHRA,"36.831137,10.326206","2, Rue OMAR BEN CHEIKH TUNIS CITE EL KHADHRA",71773438,DAY
Pharmacie ARIANE DORRA,CITE EL KHADHRA,"36.832166,10.326206","2, Rue DE LA JEUNESSE TUNIS CITE EL KHADHRA",71773021,DAY
Pharmacie BELLIL NOUREDDINE,CITE EL KHADHRA,"36.833452,10.326206","112, Av LOUIS BRAILLE TUNIS CITE EL KHADHRA",71770233,DAY
Pharmacie BOUDHRAA KHIARI NEJIBA,CITE EL KHADHRA,"36.829115,10.191022","1, Rue MOHAMED CHENIK TUNIS CITE EL KHADHRA",71807561,DAY
Pharmacie GHORBEL SALIMA,CITE EL KHADHRA,"36.836298,10.191022","28, Rue 8714 TUNIS CITE EL KHADHRA",71894135,DAY
Pharmacie BEN JANNET FATMA,CITE EL KHADHRA,"36.835118,10.191022","14 bis, Rue ABDERRAHMEN GHARIANI TUNIS CITE EL KHADHRA",71771691,DAY
Pharmacie KARRAY HOUSSEM,CITE EL KHADHRA,"36.829920,10.191022","92, Av Louis Braille TUNIS CITE EL KHADHRA",71806553,DAY
Pharmacie KAMMOUN MAHMOUD,CITE EL KHADHRA,"36.825857,10.191022",Rte X2 - Imm El HAKIM TUNIS CITE EL KHADHRA,71902777,DAY
Pharmacie JELLOULI KLIBI MONIA,CITE MHIRI,"36.854416,10.191022","46, Av HABIB BOURGUIBA TUNIS CITE MHIRI",71725283,DAY
Pharmacie HAMOUDA NAJET,CITE MHIRI,"36.852679,10.191022","4, Av MONGI SLIM - Rce SOLTAN TUNIS CITE MHIRI",70855855,DAY
Pharmacie BAKLOUTI JALELEDDINE,CITE MHIRI,"36.849406,10.191022","5, Av HABIB BOURGUIBA TUNIS CITE MHIRI",71724301,DAY
Pharmacie BELHEDI SAMIA,CITE MHIRI,"36.859499,10.191022",Av DAR FADHAL - Rce LES EMERAUDES TUNIS CITE MHIRI,71760677,DAY
Pharmacie BEN KHEDHER BEN NEJI SOUKEINA,EL MENZAH,"36.844951,10.183415",Av DU 10 DECEMBRE - IMM SAADI TUNIS EL MENZAH,71233789,DAY
Pharmacie BAHRI KHALED,EL OMRANE,"36.818273,10.183415","10, Rue AHMED CHAWKI TUNIS EL OMRANE",71959229,DAY
Pharmacie HMAIDI LATIFA,EL OMRANE,"36.819931,10.183415","161, Rue DES OLIVIERS TUNIS EL OMRANE",71896489,DAY
Pharmacie TABKA RACHED,EL OMRANE,"36.817428,10.183415","24, Rue DES OLIVIERS TUNIS EL OMRANE",71896240,DAY
Pharmacie BEL HADJ YAHIA MONCEF,EL OUERDIA,"36.772226,10.183415","11, Rue NICOLAS BERANGER TUNIS EL OUERDIA",71494495,DAY
Pharmacie HAMDI TAOUFIK,EL OUERDIA,"36.769907,10.183415","49, Av DU 3 AOUT TUNIS EL OUERDIA",71494158,DAY
Pharmacie CHAMMARI MEKKI HANEN,EL OUERDIA,"36.772097,10.183415",Av DU 15 OCTOBRE TUNIS EL OUERDIA,71493771,DAY
Pharmacie JALEL ABDALLAH,EL OUERDIA,"36.780403,10.183415","23, Av DE BELLEVUE TUNIS EL OUERDIA",71399214,DAY
Pharmacie MEMMI EL AYEB AFEF,EL OUERDIA,"36.775502,10.183415","84, Av DE BELLEVUE TUNIS EL OUERDIA",71397071,DAY
Pharmacie BEN ZINA SLIM,ETTAHRIR,"36.824833,10.183415","15, Rue IBN NIZAR TUNIS ETTAHRIR",71223418,DAY
Pharmacie FRIKHA CHOKRI,ETTAHRIR,"36.832826,10.124215",Rue 6851 TUNIS ETTAHRIR,71927478,DAY
Pharmacie SAHLI ACHOUR BOUTHEINA,ETTAHRIR,"36.832411,10.124215",Rte DE BIZERTE Km 3 - Rce ZARROUK TUNIS ETTAHRIR,71503544,DAY
Pharmacie ZAHAR MOHAMED TAHER,ETTAHRIR,"36.826356,10.124215","6, Rue IBN NASR TUNIS ETTAHRIR",71223455,DAY
Pharmacie CHEMLI FAOUZI,ETTAHRIR,"36.824450,10.124215","13, Rue ESSOUFI TUNIS ETTAHRIR",71223123,DAY
Pharmacie LAZREG MALIKA,ETTAHRIR,"36.830547,10.124215",MC 130 - Rce ESSADAKA TUNIS ETTAHRIR,71506782,DAY
Pharmacie GRASSA MOHAMED KAMEL,ETTAHRIR,"36.823487,10.124215",CENTRE COMMERCIAL TUNIS ETTAHRIR,71581555,DAY
Pharmacie SNOUSSI KOUBAA LEILA,ETTAHRIR,"36.818279,10.124215","8, Av MONGI SLIM - Ksar Said 2 TUNIS ETTAHRIR",71516508,DAY
Pharmacie CHICHTI RACHED,EZZOUHOUR,"36.796751,10.124215","61, Av 13 AOUT TUNIS EZZOUHOUR",71221945,DAY
Pharmacie FENDRI CHEDLI,EZZOUHOUR,"36.798727,10.124215","93, Rue SABRA ET CHATILA TUNIS EZZOUHOUR",71528151,DAY
Pharmacie KHABTHANI FAROUK,EZZOUHOUR,"36.794444,10.124215",Rue SABRA ET CHATILA TUNIS EZZOUHOUR,71529614,DAY
Pharmacie PHARMACIE KSOURI,EZZOUHOUR,"36.796013,10.138486","1, Rue 4001 TUNIS EZZOUHOUR",71529902,DAY
Pharmacie MAALEJ ELLOUMI RYM,EZZOUHOUR,"36.797180,10.138486","21 bis, Rue DU 13 AOUT TUNIS EZZOUHOUR",71508403,DAY
Pharmacie MELLOULI MAHMOUD,EZZOUHOUR,"36.793544,10.138486","109, Rue 4001 TUNIS EZZOUHOUR",71596822,DAY
Pharmacie BEN MAHMOUD LILIA,HRAIRIA,"36.788553,10.138486",Av EL HRAIRIA TUNIS HRAIRIA,71529777,DAY
Pharmacie FAKHFAKH ALI,HRAIRIA,"36.792274,10.138486","61, Av ENNAKHIL TUNIS HRAIRIA",71599118,DAY
Pharmacie GRINA HABIBA,HRAIRIA,"36.787702,10.138486","116, Rue 4128 TUNIS HRAIRIA",71528631,DAY
Pharmacie TURKI SIHEM,HRAIRIA,"36.789906,10.138486","187 bis, Rue HOUCINE DEY TUNIS HRAIRIA",71646375,DAY
Pharmacie BEN SLIMANE DORSAF,HRAIRIA,"36.790353,10.138486","27, Rue TAHAR MEJRI TUNIS HRAIRIA",71529418,DAY
Pharmacie BENNOUR DALENDA,HRAIRIA,"36.783874,10.138486","33, Rue 4667 TUNIS HRAIRIA",71598335,DAY
Pharmacie TAABOURI MAROUENE,HRAIRIA,"36.794859,10.138486",Rue 4366 TUNIS HRAIRIA,71938735,DAY
Pharmacie BEN SALEM ANOUAR LANDA,HRAIRIA,"36.791075,10.121268","4, Av EL HRAIRIA TUNIS HRAIRIA",71526960,DAY
Pharmacie CHAABOUNI MOHAMED ADEL,HRAIRIA,"36.798668,10.121268",Rte DU KEF TUNIS HRAIRIA,71938695,DAY
Pharmacie LANDOLSI BOUTHEINA,HRAIRIA,"36.789562,10.121268",Av DES PALMIERS TUNIS HRAIRIA,71599465,DAY
Pharmacie AOUINI BERRICHE AROUA,IBN KHALDOUN,"36.835265,10.121268","38, Rue 6670 TUNIS IBN KHALDOUN",71925415,DAY
Pharmacie BEN TKHAYAT ABDELKERIM,IBN KHALDOUN,"36.826800,10.121268","14 bis, Av EL FAOUZ TUNIS IBN KHALDOUN",71924436,DAY
Pharmacie LAOUANI CHERIFA,IBN KHALDOUN,"36.839740,10.121268","36, Rue SALAH JEBLA TUNIS IBN KHALDOUN",71924318,DAY
Pharmacie SNOUSSI BEN OTHMEN HOUDA,IBN KHALDOUN,"36.837379,10.121268","2, Rue 6979 TUNIS IBN KHALDOUN",71920273,DAY
Pharmacie TOUMI AIDA,IBN KHALDOUN,"36.825036,10.121268","74, Av EL FAOUZ TUNIS IBN KHALDOUN",71922031,DAY
Pharmacie MEHREZ ALIA,IBN KHALDOUN,"36.828976,10.121268",Rue 6597 TUNIS IBN KHALDOUN,71929347,DAY
Pharmacie CHERIF SONIA,JEBEL JELLOUD,"36.770667,10.121268","144, Rue 9042 TUNIS JEBEL JELLOUD",71490206,DAY
Pharmacie OUERGHI ABDELMAJID,JEBEL JELLOUD,"36.771114,10.202278","42, Rue SKIKDA TUNIS JEBEL JELLOUD",71397815,DAY
Pharmacie JEMMALI RACHIDA,JEBEL JELLOUD,"36.764865,10.202278","87, Rue 9007 TUNIS JEBEL JELLOUD",71483879,DAY
Pharmacie BEN HAMIDA FATMA,KABBARIA,"36.760209,10.202278","11, Rue 10114 TUNIS KABBARIA",71492035,DAY
Pharmacie KHEMIRI LASSAAD,KABBARIA,"36.760924,10.202278","3, Rue 10236 TUNIS KABBARIA",71371754,DAY
Pharmacie BELKACEM SLAH,KABBARIA,"36.760824,10.202278",MARCHE EL KABBARIA TUNIS KABBARIA,71494053,DAY
Pharmacie CHALA MOHAMED,KABBARIA,"36.760253,10.202278","70, Rue MAOUSSILI TUNIS KABBARIA",71372810,DAY
Pharmacie GUENAIEN LOTFI,KABBARIA,"36.759483,10.202278","17, Rue 10656 TUNIS KABBARIA",71370550,DAY
Pharmacie SMAOUI HAMDI AMEL,LA GOULETTE,"36.819835,10.202278","62, Av HABIB BOURGUIBA TUNIS LA GOULETTE",71735684,DAY
Pharmacie CHELFOUH ABDELHAMID,LA GOULETTE,"36.816329,10.202278","3, Av ROOSEVELT TUNIS LA GOULETTE",71735232,DAY
Pharmacie BEN SLAMA ZOUARI LEILA,LA MARSA,"36.889663,10.202278","60, Av TAIEB MHIRI TUNIS LA MARSA",71774754,DAY
Pharmacie DJAIT BARAKAT ZEINEB,LA MARSA,"36.881549,10.321595","12, Rue MOHAMED ALI TUNIS LA MARSA",71775963,DAY
Pharmacie LOUZIR BEN MESSAOUD AIDA,LA MARSA,"36.866344,10.321595",CENTRE COMMERCIAL CARREFOUR TUNIS LA MARSA,71779075,DAY
Pharmacie BELKHOUJA LAAOUITI EYA,LA MARSA,"36.882175,10.321595","1, Rue DU 13 AOUT TUNIS LA MARSA",71740775,DAY
Pharmacie CHAMAKH SABBAGH JALILA,LA MARSA,"36.884175,10.321595","129, Rue HEDI CHAKER TUNIS LA MARSA",71729611,DAY
Pharmacie DARGHOUTH MANNOUBI,LA MARSA,"36.876645,10.321595","7, Av DE LA REPUBLIQUE TUNIS LA MARSA",71980857,DAY
Pharmacie KAHIA SLIMANE,LA MARSA,"36.888463,10.321595","60, Rue DU KOWEIT TUNIS LA MARSA",71743112,DAY
Pharmacie BOUAZIZ LOBNA,LA MARSA,"36.886029,10.321595","37, Av TAIEB MHIRI TUNIS LA MARSA",71748471,DAY
Pharmacie NAJJAR ZIED,LA MARSA,"36.876306,10.321595","16, Av DE L'INDEPENDANCE TUNIS LA MARSA",71775094,DAY
Pharmacie BEN AYED FARAH,LA MARSA,"36.885481,10.321595","104, Av HEDI CHAKER TUNIS LA MARSA",71775574,DAY
Pharmacie MAOUSILI MEHERZI IBTISSEM,LA MARSA,"36.904761,10.321595","64 bis, Av DE L'ENVIRONNEMENT TUNIS LA MARSA",71918697,DAY
Pharmacie PHARMACIE ZMERLI,LA MARSA,"36.879319,10.327668","3, PLACE MONCEF BEY TUNIS LA MARSA",71746301,DAY
Pharmacie BENZARTI CHAYATA LATIFA,LA MARSA,"36.866897,10.327668","2, Rue IMAM MAZRI TUNIS LA MARSA",71779500,DAY
Pharmacie FARHAT ALI,LA MARSA,"36.884541,10.327668","48, Rue IMAM IBN ARAFA TUNIS LA MARSA",71982665,DAY
Pharmacie MELLOULI MABROUK DONIA,LA MARSA,"36.882254,10.327668",Rue DE LA MOSQUEE TUNIS LA MARSA,71747144,DAY
Pharmacie CHEKIR AIDA,LA MARSA,"36.878076,10.327668",Rue EZZINE BEN ACHOUR TUNIS LA MARSA,71740444,DAY
Pharmacie EZZINE GHANNOUCHI IMENE,LA MARSA,"36.883898,10.327668","27, Rue EL MEKKI TUNIS LA MARSA",71748574,DAY
Pharmacie BEN YAHIA AMEL,LA MARSA,"36.878184,10.327668",Rue CHARLES de GAULLE TUNIS LA MARSA,70692401,DAY
Pharmacie HABABOU GHARIANI FAIKA,LA MARSA,"36.884317,10.327668",Av HABIB BOURGUIBA TUNIS LA MARSA,71728200,DAY
Pharmacie RAIS ZOUITEN IBTISSEM,LA MARSA,"36.879518,10.327668","5, Rue ABDELAZIZ CHTIOUI TUNIS LA MARSA",71775416,DAY
Pharmacie BEN FADHLOUN SAMI,LA MARSA,"36.876278,10.317113",Rue DU STADE - Imm YASMINE TUNIS LA MARSA,71743317,DAY
Pharmacie BEN MARZOUK BASMA,LA MARSA,"36.882481,10.317113",Av TAIEB MHIRI TUNIS LA MARSA,71775715,DAY
Pharmacie MGHANEM HOUDA,LA MARSA,"36.887285,10.317113",Rte DE GAMMARTH - Rce SABRINA TUNIS LA MARSA,71917940,DAY
Pharmacie DARMOUL CHERIF,LE KRAM,"36.841609,10.317113","16, Rue ERRIADH TUNIS LE KRAM",71971351,DAY
Pharmacie SNOUSSI KHALED,LE KRAM,"36.836324,10.317113","31, Rue DES MARTYRS TUNIS LE KRAM",71973191,DAY
Pharmacie ZOUITEN HABIB,LE KRAM,"36.832995,10.317113","177, Av HABIB BOURGUIBA TUNIS LE KRAM",71276369,DAY
Pharmacie BELAJOUZA RACHID,LE KRAM,"36.835700,10.317113","274, Av HABIB BOURGUIBA TUNIS LE KRAM",71275139,DAY
Pharmacie BEN ABDALLAH ANIS,LE KRAM,"36.840967,10.317113","49, Av FARHAT HACHED TUNIS LE KRAM",71970603,DAY
Pharmacie ENNAIFER MOHAMED MONDHER,LE KRAM,"36.839693,10.317113","74 bis, Av FARHAT HACHED TUNIS LE KRAM",71975260,DAY
Pharmacie GHARBI TABKA HOUDA,LE KRAM,"36.836983,10.317113","23, Rue HOUCINE BOUZAYENE TUNIS LE KRAM",71276822,DAY
