pharmacyName,town,cordinates,streetAdress,phoneNumber,type
Pharmacie MELLOULI GHARIANI SONIA,LE KRAM,"36.843295,10.316120","3 bis, Av FARHAT HACHED TUNIS LE KRAM",71977847,DAY
Pharmacie BAKLOUTI HICHEM,LE KRAM,"36.838727,10.316120",Av HABIB BOURGUIBA TUNIS LE KRAM,71720728,DAY
Pharmacie LAZAAR LAZRAG AICHA,LE KRAM,"36.842057,10.316120","29, Av FARHAT HACHED TUNIS LE KRAM",71971053,DAY
Pharmacie MESSAADI BEY AMEL FAOUZIA,LE KRAM,"36.830123,10.316120","143, Av HABIB BOURGUIBA  TUNIS LE KRAM",71275979,DAY
Pharmacie NAJJAR LOTFI,LE KRAM,"36.846679,10.316120",YASMINA TUNIS LE KRAM,71985825,DAY
Pharmacie ACHOUR AMRI SOUAD,MANAR,"36.839630,10.316120","10, Av TAHAR BEN AMMAR TUNIS MANAR",71883527,DAY
Pharmacie BEN CHAABANE SALAH,MANAR,"36.835523,10.316120",Av HABIB CHATTI - DELTA MEDICAL TUNIS MANAR,71870835,DAY
Pharmacie CHEHATA MHAMED,MANAR,"36.837046,10.316120",CENTRE PHENICIA TUNIS MANAR,71880035,DAY
Pharmacie DJAIBI TLEMCANI NEJIBA,MANAR,"36.835026,10.316120",Imm LE CAMPUS TUNIS MANAR,71874463,DAY
Pharmacie FAKHFAKH KRICHEN LEILA,MANAR,"36.850822,10.316120",Rce LES PYRENEES TUNIS MANAR,70865209,DAY
Pharmacie FAZAA HEDI,MANAR,"36.839236,10.160256","36, Av du ROI ABDELAZIZ TUNIS MANAR",71883509,DAY
Pharmacie KARRAY TAREK,MANAR,"36.841482,10.160256","32, Av MOHEIDDIENE KLIBI TUNIS MANAR",71889633,DAY
Pharmacie BEN MARZOUK IBTISSEM,MANAR,"36.835030,10.160256",Av HABIB CHATTI TUNIS MANAR,71884317,DAY
Pharmacie MESTIRI ZELIZI KHEDIJA,MANAR,"36.835327,10.160256","4, Rue 7400 - Rce HANNIBAL TUNIS MANAR",70861333,DAY
Pharmacie MRABET MILADI NEDRA,MANAR,"36.838009,10.160256",COLISEE SOULA TUNIS MANAR,71884015,DAY
Pharmacie SASSI KHALED,MANAR,"36.840419,10.160256","2, Av TAHAR SFAR TUNIS MANAR",71875853,DAY
Pharmacie ZAHAR MOUAFFAK AHLEM,MANAR,"36.842603,10.160256",Av DU ROI ABDELAZIZ - MAGHREB MEDICAL TUNIS MANAR,70860531,DAY
Pharmacie ZOUARI MOURAD,MANAR,"36.841935,10.160256","14, Av TAHAR SFAR TUNIS MANAR",71889242,DAY
Pharmacie JARRAYA ADEL,MELLASSINE,"36.795539,10.160256","2, Rue OMAR IBN EL KHATTAB TUNIS MELLASSINE",71563327,DAY
Pharmacie BEN MANSOUR HICHERI LATIFA,MELLASSINE,"36.799100,10.160256","131, Av MUSTAPHA KHAZNADAR TUNIS MELLASSINE",71560659,DAY
Pharmacie ABDENNADHER ESSIA,MENZAH 1,"36.835874,10.179194","14, Rue EL MOEZ TUNIS MENZAH 1",71233714,DAY
Pharmacie KARRAY ALLOUCHE NADA,MENZAH 1,"36.843110,10.179194","54 bis, Av 10 DECEMBRE TUNIS MENZAH 1",71232255,DAY
Pharmacie KASBI MOHAMED HEDI,MENZAH 1,"36.837953,10.179194","14, Av EL MENZAH TUNIS MENZAH 1",71767856,DAY
Pharmacie BEJAR MOUNIR,MENZAH 9,"36.847616,10.179194","22, Rue ALI AYARI TUNIS MENZAH 9",71888413,DAY
Pharmacie BEN GHACHEM LOTFI,MENZAH 9,"36.845971,10.179194",Av TAHAR BEN AMMAR - ESPACE MAKNI TUNIS MENZAH 9,70861034,DAY
Pharmacie HACHICHA DORRA,MENZAH 9,"36.844131,10.179194","38, Av TAHAR BEN AMMAR TUNIS MENZAH 9",71883322,DAY
Pharmacie MILADI SONIA,MENZAH 9,"36.851593,10.179194",Rue Sadok Belhadj - MARCHE MUNICIPAL TUNIS MENZAH 9,70861837,DAY
Pharmacie BEN YAHIA HABIB,MONTFLEURY,"36.784391,10.179194","27, Av ABOU ZAKARIA EL HAFSI TUNIS MONTFLEURY",71397816,DAY
Pharmacie BELLAGHA THAMEUR KAOUTHER,MONTFLEURY,"36.778079,10.179194","55, Av DU SAHEL TUNIS MONTFLEURY",71392694,DAY
Pharmacie BOUZOUITA MOHAMED ALI,MONTFLEURY,"36.774966,10.179194","89, Rue DU SAHEL TUNIS MONTFLEURY",71483384,DAY
Pharmacie CHEBBAH CHOKRI,MONTPLAISIR,"36.819528,10.190584",Rue 8300 - Imm LUXOR TUNIS MONTPLAISIR,71791126,DAY
Pharmacie BELKAHIA SIHEM,MONTPLAISIR,"36.816962,10.190584",Av DU JAPON - Imm SAFSAF TUNIS MONTPLAISIR,71902695,DAY
Pharmacie LABOUP NAOUAR MARYSE EVELYNE,MOUROUJ 2,"36.742448,10.190584",Bd DE LA MEDITERRANEE TUNIS MOUROUJ 2,71376660,DAY
Pharmacie AMOUS MOHAMED CHEDLI,MUTUELLEVILLE,"36.829754,10.190584","2, Rue BADI AZZAMAN TUNIS MUTUELLEVILLE",71287391,DAY
Pharmacie CHOUIKHA MOHAMED ABDELWAHEB,MUTUELLEVILLE,"36.836555,10.190584","2, Rue TAREK IBN ZIED TUNIS MUTUELLEVILLE",71796570,DAY
Pharmacie FENIRA TAOUFIK,MUTUELLEVILLE,"36.836353,10.190584","121, Av JUGHURTA TUNIS MUTUELLEVILLE",71891604,DAY
Pharmacie LAKHOUA NAJAH SARRA,MUTUELLEVILLE,"36.831495,10.190584",Rue DE CHERBOURG TUNIS MUTUELLEVILLE,71848213,DAY
Pharmacie MALOUCHE MOHAMED FAOUZI,MUTUELLEVILLE,"36.832535,10.190584",NORD HILTON - FACE CLINIQUE TAOUFIK TUNIS MUTUELLEVILLE,71849647,DAY
Pharmacie MSAHLI LASSAAD,MUTUELLEVILLE,"36.838618,10.190584","25, Rue AZIZA OTHMANA TUNIS MUTUELLEVILLE",71796066,DAY
Pharmacie RIAHI MOHAMED TAOUFIK,MUTUELLEVILLE,"36.827163,10.179855","37, Av CHARLES NICOLLE TUNIS MUTUELLEVILLE",71846212,DAY
Pharmacie TAIEB ABDELWAHEB,SIDI BOU SAID,"36.871005,10.179855","80, Rue SLAHEDDINE BOUCHOUCHA TUNIS SIDI BOU SAID",71747795,DAY
Pharmacie MILED BASSEM,SIDI BOU SAID,"36.86915669,10.179855",Av HABIB BOURGUIBA TUNIS SIDI BOU SAID,71741214,DAY
Pharmacie FENDRI MARIEM,SIDI HASSINE,"36.772372,10.179855","71, Rue 4850 TUNIS SIDI HASSINE",71590253,DAY
Pharmacie JARRAY ABDELMAJID,SIDI HASSINE,"36.762942,10.179855","48 bis, Rue 4883 TUNIS SIDI HASSINE",71590690,DAY
Pharmacie KECHAOU MOHAMED GHAZI,SIDI HASSINE,"36.780292,10.179855",Rte N5 TUNIS SIDI HASSINE,71559807,DAY
Pharmacie MILI MEHREZ,SIDI HASSINE,"36.775358,10.179855","5, Rue 4850 TUNIS SIDI HASSINE",71592604,DAY
Pharmacie ZAHAF SAFOUANE,SIDI HASSINE,"36.768948,10.179855",Rue 4883 TUNIS SIDI HASSINE,71934401,DAY
Pharmacie BEKDACHE ASSIA,SIDI HASSINE,"36.772041,10.179855",Av DU 14 JANVIER TUNIS SIDI HASSINE,71934000,DAY
Pharmacie HASNAOUI MONIA,SIDI HASSINE,"36.768087,10.179855","125, Rue 42800 TUNIS SIDI HASSINE",71934242,DAY
Pharmacie JEMMALI MOHAMED ABDELHAMID,SIDI HASSINE,"36.778513,10.113135",Rue 42590 TUNIS SIDI HASSINE,71935897,DAY
Pharmacie MESSAOUDIA YASSINE,SIDI HASSINE,"36.755976,10.113135",Rte ATTAR Km 7. TUNIS SIDI HASSINE,71934754,DAY
Pharmacie JERBI JEMLI WAHIBA,SIDI HASSINE,"36.781990,10.113135",Rte DE MORNAGUIA TUNIS SIDI HASSINE,71935652,DAY
Pharmacie KAMMOUN BESMA,SIDI HASSINE,"36.765462,10.113135","45 bis, Rue 4883 TUNIS SIDI HASSINE",71592684,DAY
Pharmacie LAATIL TAMBOURA INSAF,SIDI HASSINE,"36.762238,10.113135",Rue 42710 ET Rue 40850 TUNIS SIDI HASSINE,71591410,DAY
Pharmacie LAKHOUA RYM,SIDI HASSINE,"36.765636,10.113135",Rte DE ATTAR Km 7 TUNIS SIDI HASSINE,71225181,DAY
Pharmacie ABDELMOUMEN SLAHEDDINE,TUNIS VILLE,"36.807462,10.113135","15, Av DE MADRID TUNIS TUNIS VILLE",71252030,DAY
Pharmacie BEN AYED BEN HASSINE KHANSA,TUNIS VILLE,"36.798452,10.113135","3, Av DE CARTHAGE TUNIS TUNIS VILLE",71335643,DAY
Pharmacie BEN MARZOUK BASSEM,TUNIS VILLE,"36.809044,10.113135","29, Av DE LA LIBERTE TUNIS TUNIS VILLE",71830971,DAY
Pharmacie BSILA ALI,HRAIRIA,"36.78387,10.10950",HRAIRIA TUNIS HRAIRIA,71891910,DAY
Pharmacie CHAHED EL MUFTI FERIDA,TUNIS VILLE,"36.798480,10.10950","187 bis, Rue DE LA KASBAH TUNIS TUNIS VILLE",71260075,DAY
Pharmacie ENNAIFER HICHEM,TUNIS VILLE,"36.801771,10.10950","63, Rue MONGI SLIM TUNIS TUNIS VILLE",71256147,DAY
Pharmacie SARRAY RADHIA,TUNIS VILLE,"36.805653,10.10950","30, Av ALI BELHOUANE TUNIS TUNIS VILLE",71260409,DAY
Pharmacie TURKI YOSRI,TUNIS VILLE,"36.807021,10.10950","46, Av HEDI NOUIRA TUNIS TUNIS VILLE",71255036,DAY
Pharmacie BEL HADJ ALI SAMIR,TUNIS VILLE,"36.815528,10.10950","59, Av TAIEB MHIRI TUNIS TUNIS VILLE",71783562,DAY
Pharmacie BEN NJEH AOUIDA RIHAB,TUNIS VILLE,"36.797564,10.10950","54, Av FARHAT HACHED TUNIS TUNIS VILLE",71340797,DAY
Pharmacie DARGHOUTH RADHI,TUNIS VILLE,"36.811260,10.10950","37, Av CHEDLI KALLALA TUNIS TUNIS VILLE",71287723,DAY
Pharmacie DRIRA OTHMEN,TUNIS VILLE,"36.796090,10.10950","10, Rue D'ANGLETERRE TUNIS TUNIS VILLE",71320236,DAY
Pharmacie HAMADA OUM EL KHIR,TUNIS VILLE,"36.807695,10.10950","75, Rue BAB EL KHADHRA TUNIS TUNIS VILLE",71252095,DAY
Pharmacie MOKADDEM MOHAMED LASSAAD,TUNIS VILLE,"36.803863,10.172748","17, Rue BAB SOUIKA TUNIS TUNIS VILLE",71564684,DAY
Pharmacie OUAHCHI AMINE MAHDI,TUNIS VILLE,"36.792520,10.172748","42, Rue DE LA SABKHA TUNIS TUNIS VILLE",71332741,DAY
Pharmacie ZOUARI MALEK,TUNIS VILLE,"36.803693,10.172748","20, Av HABIB THAMEUR TUNIS TUNIS VILLE",71241992,DAY
Pharmacie BELKAHIA BOUCHOUCHA LEILA,TUNIS VILLE,"36.800518,10.172748","9, Rue D'ALGER TUNIS TUNIS VILLE",71255989,DAY
Pharmacie BEN HTIRA BEN ABDALLAH SALWA,TUNIS VILLE,"36.820974,10.172748","46, Av KHEIREDDINE PACHA TUNIS TUNIS VILLE",71909229,DAY
Pharmacie FOURATI MEHDI,MENZAH 1,"36.838503,10.172748","18, Rue ABDENNABI TUNIS MENZAH 1",71232914,DAY
Pharmacie CHEOUR SOFIENE,TUNIS VILLE,"36.799380,10.172748","1, Rue DE TURQUIE TUNIS TUNIS VILLE",71257028,DAY
Pharmacie JAZI KHALED,TUNIS VILLE,"36.814582,10.172748","77, Av DE LA LIBERTE TUNIS TUNIS VILLE",71892017,DAY
Pharmacie KAMMOUN MOHAMED,TUNIS VILLE,"36.804340,10.172748","156, Rue BAB SOUIKA TUNIS TUNIS VILLE",71560405,DAY
Pharmacie KRIFA BAHRI ZEINEB,TUNIS VILLE,"36.792112,10.172748","24, Rue BAB JEDID TUNIS TUNIS VILLE",71336865,DAY
Pharmacie OUERTANI REGAYA SAMIRA,TUNIS VILLE,"36.810773,10.163452","9, Rte DE L'ARMEE NATIONALE TUNIS TUNIS VILLE",71899232,DAY
Pharmacie TRITAR AHMED,TUNIS VILLE,"36.802461,10.163452","29, Av DE PARIS TUNIS TUNIS VILLE",71347128,DAY
Pharmacie ABID MOHAMED ALI,TUNIS VILLE,"36.806866,10.163452","6, Av DE LA LIBERTE TUNIS TUNIS VILLE",71240480,DAY
Pharmacie BEN FREDJ SAMIHA,TUNIS VILLE,"36.805205,10.163452","110, PLACE BAB SOUIKA TUNIS TUNIS VILLE",71560079,DAY
Pharmacie BEN ISMAIL CHEBIL MALIKA,TUNIS VILLE,"36.801153,10.163452","18, Rue DE ROME TUNIS TUNIS VILLE",71331031,DAY
Pharmacie CHAOUCH ABDELKADER,TUNIS VILLE,"36.816671,10.163452","79, Av HEDI CHAKER TUNIS TUNIS VILLE",71289806,DAY
Pharmacie KHABTHANI OMAR,TUNIS VILLE,"36.796861,10.163452","10, Rue D'ESPAGNE TUNIS TUNIS VILLE",71320585,DAY
Pharmacie KHABTHANI TAOUFIK,TUNIS VILLE,"36.793415,10.163452","27, Av BAB MENARA TUNIS TUNIS VILLE",71560724,DAY
Pharmacie MOALLA ISSAM,TUNIS VILLE,"36.812661,10.163452","29, Av TAIEB MHIRI TUNIS TUNIS VILLE",71289389,DAY
Pharmacie SANAA AMEL,TUNIS VILLE,"36.820574,10.163452","83, Av MOHAMED V TUNIS TUNIS VILLE",71798398,DAY
Pharmacie BEL KAALOUL MOHAMED AHMED,TUNIS VILLE,"36.794911,10.179526","3, PLACE MONGI BALI TUNIS TUNIS VILLE",71259858,DAY
Pharmacie BEN AYED KETARI SALWA,TUNIS VILLE,"36.802752,10.179526","26, Av JEAN JAURES TUNIS TUNIS VILLE",71257413,DAY
Pharmacie DJAIT MOHAMED,TUNIS VILLE,"36.801729,10.179526","32, Rue SIDI BOUHDID TUNIS TUNIS VILLE",71569494,DAY
Pharmacie KECHRID MOUNIR,TUNIS VILLE,"36.796702,10.179526","27, Rue EL JAZIRA TUNIS TUNIS VILLE",71327609,DAY
Pharmacie KHESSAIRI HABIB,MUTUELLEVILLE,"36.829904,10.179526","11, Rue MAHRAJENE TUNIS MUTUELLEVILLE",71782416,DAY
Pharmacie LASMAR ABDESSATTAR,TUNIS VILLE,"36.792187,10.179526","60, Av BAB DJEDID TUNIS TUNIS VILLE",71256790,DAY
Pharmacie SELMANE MOHAMED,TUNIS VILLE,"36.794320,10.179526","56 bis, Rue HOUCINE BOUZAIENE TUNIS TUNIS VILLE",71349456,DAY
Pharmacie TRABELSI ABDELWAHEB,TUNIS VILLE,"36.816136,10.179526","17, Av DES ETATS-UNIS TUNIS TUNIS VILLE",71892656,DAY
Pharmacie TRABELSI ADLENE,TUNIS VILLE,"36.807099,10.179526","12, Rue BELHASSINE JRAD TUNIS TUNIS VILLE",71331920,DAY
Pharmacie BEL HADJ AMMAR TAOUFIK,TUNIS VILLE,"36.790494,10.179526","50, Rue SIDI EL BECHIR TUNIS TUNIS VILLE",71253023,DAY
Pharmacie BEN AYED JARRAYA AMEL,TUNIS VILLE,"36.804386,10.163075","103, Bd DU 9 AVRIL - Imm SNIT TUNIS TUNIS VILLE",71570700,DAY
Pharmacie BEN YAHMED AIDA HAJER,TUNIS VILLE,"36.799658,10.163075","8 bis, Rue MONGI SLIM TUNIS TUNIS VILLE",71326382,DAY
Pharmacie BEN YAHMED MONCEF,TUNIS VILLE,"36.793843,10.163075","23, PLACE DE LEADER TUNIS TUNIS VILLE",71564511,DAY
Pharmacie CHOUIKHA BEN MARZOUK AROUA,TUNIS VILLE,"36.811648,10.163075","55, Av DE LA LIBERTE TUNIS TUNIS VILLE",71830578,DAY
Pharmacie MAALEJ MOHAMED NEJIB,TUNIS VILLE,"36.822156,10.163075",PLACE PASTEUR TUNIS TUNIS VILLE,71282284,DAY
Pharmacie MOUDIR MOLKA,TUNIS VILLE,"36.797992,10.163075","4, Rue JAMEL ABDENNACEUR TUNIS TUNIS VILLE",71327806,DAY
Pharmacie PHARMACIE DU PARC,TUNIS VILLE,"36.805862,10.163075","73, Av DE LONDRES TUNIS TUNIS VILLE",71241701,DAY
Pharmacie RATEL RYM,TUNIS VILLE,"36.802734,10.163075","16, Rue D'ATHENES TUNIS TUNIS VILLE",71349346,DAY
Pharmacie TANBOURA SOUHEIL,TUNIS VILLE,"36.799776,10.163075","44, Av HABIB BOURGUIBA TUNIS TUNIS VILLE",71252535,DAY
Pharmacie ALJENE MOHAMED,TUNIS VILLE,"36.791780,10.163075","47, Rue EL MORKADH TUNIS TUNIS VILLE",71572512,DAY
Pharmacie BELKAID REJEB,TUNIS VILLE,"36.802895,10.165538","12, Av BAB BNET TUNIS TUNIS VILLE",71561360,DAY
Pharmacie BOUZAYENE MILED NEFISSA,TUNIS VILLE,"36.806087,10.165538","40, Av DU GHANA TUNIS TUNIS VILLE",71255829,DAY
Pharmacie DARGHOUTH MOHAMED EL MAHDI,TUNIS VILLE,"36.793731,10.165538","54, Rue EL JAZIRA TUNIS TUNIS VILLE",71328516,DAY
Pharmacie BEN JEMAA HAJER,TUNIS VILLE,"36.800145,10.165538","3, Rue DE ROME TUNIS TUNIS VILLE",71341935,DAY
Pharmacie KARRAY AHMED,TUNIS VILLE,"36.805651,10.165538","147, Av DE LONDRES TUNIS TUNIS VILLE",71343637,DAY
Pharmacie LAKHOUA ELYES,TUNIS VILLE,"36.826355,10.165538","22, Av ALAIN SAVARY TUNIS TUNIS VILLE",71280161,DAY
Pharmacie MAHJOUB SONIA,TUNIS VILLE,"36.798492,10.165538","88, Rue DE YOUGOSLAVIE TUNIS TUNIS VILLE",71254668,DAY
Pharmacie SAYAH NESRINE,TUNIS VILLE,"36.813143,10.165538","44, Av HEDI CHAKER TUNIS TUNIS VILLE",71288287,DAY
Pharmacie BELKADHI MONCEF,TUNIS VILLE,"36.800094,10.165538","43, Av H. BOURGUIBA - LE COLISEE TUNIS TUNIS VILLE",71348443,DAY
Pharmacie BEN GHOZZIA NESRINE,TUNIS VILLE,"36.807001,10.165538","230, Rue BAB SAADOUN TUNIS TUNIS VILLE",71560972,DAY
Pharmacie BEN HAMADOU MOHAMED,TUNIS VILLE,"36.809819,10.181922","22, Rue NELSON MANDELLA TUNIS TUNIS VILLE",71833387,DAY
Pharmacie BESBES BAYA,TUNIS VILLE,"36.812790,10.181922","41, Av BECHIR SFAR TUNIS TUNIS VILLE",71892750,DAY
Pharmacie BOUASSIDA NOUREDDINE,TUNIS VILLE,"36.788906,10.181922","18, Rue ABOUL KACEM ECHEBBI TUNIS TUNIS VILLE",71242401,DAY
Pharmacie ZAHAF SALMA,TUNIS VILLE,"36.817878,10.181922","117, Av DE LA LIBERTE TUNIS TUNIS VILLE",71890295,DAY
Pharmacie ISMAIL GHASSEN,TUNIS VILLE,"36.808900,10.181922","28, Rue BELHASSINE JRAD TUNIS TUNIS VILLE",71337648,DAY
Pharmacie MOKHTAR ENNAIFER NABILA,TUNIS VILLE,"36.79725,10.181922","83, Av FARHAT HACHED TUNIS TUNIS VILLE",71322651,DAY
Pharmacie ABBES EMNA,TUNIS VILLE,"36.812860,10.181922","48 ter, Rue DE PALESTINE TUNIS TUNIS VILLE",71835643,DAY
Pharmacie BEN ABDERRAHMEN FAIZA,TUNIS VILLE,"36.80409,10.181922","34, Av DE PARIS TUNIS TUNIS VILLE",71335878,DAY
Pharmacie CHAHED LAADHARI SAMIRA,TUNIS VILLE,"36.800198,10.181922","16, Av HABIB BOURGUIBA TUNIS TUNIS VILLE",71335433,DAY
Pharmacie KESSENTINI MOHAMED,TUNIS VILLE,"36.819275,10.181922","10, Av KHEIREDDINE PACHA TUNIS TUNIS VILLE",71841136,DAY
Pharmacie LAGHOUANEM BELGACEM,TUNIS VILLE,"36.798984,10.175784","24, Av DE FRANCE TUNIS TUNIS VILLE",71320553,DAY
Pharmacie LAHMAR HAMDI,TUNIS VILLE,"36.809488,10.175784","51, Av DE LYON TUNIS TUNIS VILLE",71848845,DAY
Pharmacie OUAHCHI SAMI LOTFI,TUNIS VILLE,"36.796225,10.175784","21, Av DE CARTHAGE TUNIS TUNIS VILLE",71240362,DAY
Pharmacie BEN LAMINE DALI RADHIA,TUNIS VILLE,"36.808362,10.175784","39, PLACE HALFAOUINE TUNIS TUNIS VILLE",71563513,DAY
Pharmacie ENNEIFER AHMED,BARDO,"36.816514,10.175784","79, Av HABIB BOUGATFA TUNIS BARDO",71580052,DAY
Pharmacie NOUREDDINE NAHLA,AKOUDA,"35.87275,10.589103","9, Av DE L'ENVIRONNEMENT SOUSSE AKOUDA",73810113,
Pharmacie GHEZAL FREDJ,AKOUDA,"35.865858,10.589103",Av DE LA REPUBLIQUE SOUSSE AKOUDA,73256011,
Pharmacie CHAHED MOHAMED BECHIR,AKOUDA,"35.872076,10.589103","37, Av HABIB BOURGUIBA SOUSSE AKOUDA",73356197,
Pharmacie BEN ROMDHANE SAMIR,BOUFICHA,"36.300483,10.589103",Av HEDI CHAKER SOUSSE BOUFICHA,73252011,
Pharmacie SOLAANI HAMDA,BOUFICHA,"36.300312,10.589103",Av HEDI CHAKER SOUSSE BOUFICHA,73252963,
Pharmacie JAIDANE MOURAD,CHATT MERIEM,"35.937375,10.589103",CHATT MERIEM SOUSSE CHATT MERIEM,73248265,
Pharmacie BEN SGHAIER RAOUDHA,ENFIDHA,"36.132318,10.589103","50, Av H. BOURGUIBA - CENTRE EL KAIED SOUSSE ENFIDHA",73381421,
Pharmacie GHRAIRI SALLEM,ENFIDHA,"36.135172,10.589103",Av DE LA REPUBLIQUE SOUSSE ENFIDHA,73250033,
Pharmacie BOUSSETTA MONGI,ENFIDHA,"36.131892,10.372901",Av H. BOURGUIBA - CITE EL MOUHIT SOUSSE ENFIDHA,73250258,DAY
Pharmacie HASSANI MOHAMED,ENFIDHA,"36.134938,10.372901",CITE WAFA SOUSSE ENFIDHA,73250070,DAY
Pharmacie KSOUS IMEDEDDINE,ENFIDHA,"36.133213,10.372901",Bd DE L'ENVIRONNEMENT SOUSSE ENFIDHA,73250362,DAY
Pharmacie YOUSSEF IMED,ENFIDHA,"36.136416,10.372901",Av DE LA REPUBLIQUE SOUSSE ENFIDHA,73250460,DAY
Pharmacie BEN OUANNES FAYCEL,ERRIADH,"35.803824,10.372901",Rue ETTAOUFIK SOUSSE ERRIADH,73301669,DAY
Pharmacie SLIMEN ABDELMONOOM,ERRIADH,"35.805879,10.372901","9, Rue IBN ABI BALTAA SOUSSE ERRIADH",73300666,DAY
Pharmacie BEN TEJ FEHAL MOUFIDA,ERRIADH,"35.801202,10.372901","118, Rue ECHIFA SOUSSE ERRIADH",73304745,DAY
Pharmacie SOUA DOUIK ZEINEB,ERRIADH,"35.799599,10.372901",Rue ETTAOUFIK SOUSSE ERRIADH,73300037,DAY
Pharmacie EL AYNI NEJIB,EZZOUHOUR,"35.789999,10.372901",Av DU 9 AVRIL et Av TAIEB MHIRI SOUSSE EZZOUHOUR,73311676,DAY
Pharmacie DERBEL MOHAMED  ,EZZOUHOUR,"35.792122,10.372901",Av 9 AVRIL SOUSSE EZZOUHOUR,73311671,DAY
Pharmacie JAIDANE NOURA,EZZOUHOUR,"35.789082,10.592919",Bd DE L'ENVIRONNEMENT SOUSSE EZZOUHOUR,73311031,DAY
Pharmacie HACHICHA JAMIL,HAMMAM SOUSSE,"35.86764557,10.592919","3, Av EL MAAMOUN - Imm AMIRA SOUSSE HAMMAM SOUSSE",73361866,DAY
Pharmacie ZEBIDI SAMIR,HAMMAM SOUSSE,"35.857300,10.592919","14, Av DE LA REPUBLIQUE SOUSSE HAMMAM SOUSSE",73362740,DAY
Pharmacie DALY HATEM,HAMMAM SOUSSE,"35.855733,10.592919",Rte DE TUNIS Km 3 SOUSSE HAMMAM SOUSSE,73371929,DAY
Pharmacie OUAHADA HEDHILI FERIDA,HAMMAM SOUSSE,"35.858463,10.592919",Rue EL HARIK SOUSSE HAMMAM SOUSSE,73324062,DAY
Pharmacie BEN AMOR FAHIMA,HAMMAM SOUSSE,"35.853925,10.592919",Rue YASSER ARAFET SOUSSE HAMMAM SOUSSE,73363064,DAY
Pharmacie BEN ZAID MONCEF,HAMMAM SOUSSE,"35.857713,10.592919",Rte DE TUNIS SOUSSE HAMMAM SOUSSE,73361670,DAY
Pharmacie BEN SLIMANE KRIFA MERIEM,HAMMAM SOUSSE,"35.863249,10.592919","54, Rte DE LA PLAGE SOUSSE HAMMAM SOUSSE",73364700,DAY
Pharmacie JABNOUN BEN HASSINE WIDED,HAMMAM SOUSSE,"35.852599,10.592919",Rue FARHAT HACHED SOUSSE HAMMAM SOUSSE,73365522,DAY
Pharmacie BOUKEF RAJA,HAMMAM SOUSSE,"35.860176,10.601017","22, Rte DE LA PLAGE SOUSSE HAMMAM SOUSSE",73365352,DAY
Pharmacie FERJANI TAOUFIK,HAMMAM SOUSSE,"35.858531,10.601017","30, Rue HEDI CHAKER SOUSSE HAMMAM SOUSSE",73362027,DAY
Pharmacie MANCHOUL SALEM,HERGLA,"36.029769,10.601017",Rue DU 18 JANVIER SOUSSE HERGLA,73251466,DAY
Pharmacie BEN AMEUR ROSTOM BALKIS,KALAA EL KEBIRA,"35.871545,10.601017",CITE COMMERCIALE SOUSSE KALAA EL KEBIRA,73253560,DAY
Pharmacie BOUKADDIDA MOHAMED LAMINE,KALAA EL KEBIRA,"35.870360,10.601017",Rue DU 1er JUIN SOUSSE KALAA EL KEBIRA,73253176,DAY
Pharmacie MECHKENE HABIBA,KALAA EL KEBIRA,"35.874807,10.601017",Rue FARHAT HACHED SOUSSE KALAA EL KEBIRA,73316926,DAY
Pharmacie CHEBIL HOSNI,KALAA EL KEBIRA,"35.869344,10.601017",Av HABIB BOURGUIBA SOUSSE KALAA EL KEBIRA,73253199,DAY
Pharmacie GUEDOUAR ABDALLAH,KALAA EL KEBIRA,"35.872730,10.601017",Av DU 18 JANVIER SOUSSE KALAA EL KEBIRA,73253018,DAY
Pharmacie MANSOUR SAMIR,KALAA EL KEBIRA,"35.876004,10.601017",PLACE DE LA VICTOIRE SOUSSE KALAA EL KEBIRA,73253755,DAY
Pharmacie BEN SAAD KHELIL,KALAA EL KEBIRA,"35.871269,10.601017",Rue 20 MARS? SOUSSE KALAA EL KEBIRA,73253281,DAY
Pharmacie BEN SLIMENE ABDERRAHMEN,KALAA EL KEBIRA,"35.8812957,10.5368542","67, Av DE L'ENVIRONNEMENT SOUSSE KALAA EL KEBIRA",73354270,DAY
Pharmacie KSOUDA BOURAOUI,KALAA ESSGHIRA,"35.823003,10.5368542","20, Av HABIB BOURGUIBA SOUSSE KALAA ESSGHIRA",73249253,DAY
Pharmacie MZABI ERNEZ ASMA,KALAA ESSGHIRA,"35.826314,10.5368542",PLACE HABIB BOURGUIBA SOUSSE KALAA ESSGHIRA,73296550,DAY
Pharmacie SRIDI TAHA,KALAA ESSGHIRA,"35.822115,10.5368542","27, Av HABIB BOURGUIBA SOUSSE KALAA ESSGHIRA",73249580,DAY
Pharmacie ZORGATI KHEFACHA JALILA,KALAA ESSGHIRA,"35.824795,10.5368542",Av HABIB BOURGUIBA SOUSSE KALAA ESSGHIRA,73249144,DAY
Pharmacie BELHAOUANE SAOUSSEN,KALAA ESSGHIRA,"35.829054,10.5368542","121, Rue El FELL - CITE MANAZAH SOUSSE KALAA ESSGHIRA",73298244,DAY
Pharmacie ERNEZ BEN ZAIED FATMA,KANTAOUI,"35.893436,10.5368542",DIAR EL BAHR SOUSSE KANTAOUI,73348437,DAY
Pharmacie NASR RADHOUANE,KONDAR,"35.932421,10.5368542",Av DE LA REPUBLIQUE SOUSSE KONDAR,73389561,DAY
Pharmacie ATTIA MAHMOUD,KONDAR,"35.9325088,10.5368542",Av HABIB BOURGUIBA SOUSSE KONDAR,73389703,DAY
Pharmacie BEN ZANINA BERRICHE FAOUZIA,KSIBET SOUSSE,"35.773832,10.625308",Av HABIB BOURGUIBA SOUSSE KSIBET SOUSSE,73238243,DAY
Pharmacie LAZREG BEN DOUISSA HAGER,KSIBET SOUSSE,"35.769648,10.625308",Av DU MAGHREB ARABE SOUSSE KSIBET SOUSSE,73390900,DAY
Pharmacie MAGROUN KAOUTHER HOUDA,MESSADINE,"35.759180,10.625308",Av HABIB BOURGUIBA SOUSSE MESSADINE,73285420,DAY
Pharmacie BOUHLEL MOHAMED,MSAKEN,"35.735143,10.625308","38, Av TAIEB HACHICHA SOUSSE MSAKEN",73259290,DAY
Pharmacie KRIFA FARHAT,MSAKEN,"35.728836,10.625308","94, Rue FARHAT HACHED SOUSSE MSAKEN",73259196,DAY
Pharmacie HACHICHA AHMED,MSAKEN,"35.727296,10.625308","23, Rue DU 1er JUIN SOUSSE MSAKEN",73259119,DAY
Pharmacie RZIGA JAOUHAR,MSAKEN,"35.731408,10.625308","12, Rue DU 20 MARS SOUSSE MSAKEN",73259102,DAY
Pharmacie CHEKIR ALI,MSAKEN,"35.729882,10.625308","139, Av HABIB BOURGUIBA SOUSSE MSAKEN",73259117,DAY
Pharmacie JAIDANE NEILA,MSAKEN,"35.73401824,10.625308","1, Av TAIEB HACHICHA SOUSSE MSAKEN",73266554,DAY
Pharmacie BEN CHERIFA MOHAMED ANOUAR,MSAKEN,"35.731972,10.625308","21, Av DE LA REPUBLIQUE SOUSSE MSAKEN",73259070,DAY
Pharmacie BOURAOUI NABILA,MSAKEN,"35.737819,10.583450",Rte GP1 SOUSSE MSAKEN,73259153,DAY
Pharmacie ATROUS SALEM,MSAKEN,"35.729792,10.583450","66, Rue 20 MARS  SOUSSE MSAKEN",73259913,DAY
Pharmacie HAMIDA MAKREM,MSAKEN,"35.729517,10.583450",Rue TAIEB MHIRI SOUSSE MSAKEN,73267435,DAY
Pharmacie METHAMEM FAOUZI,SIDI BOU ALI,"35.955962,10.583450",Av HABIB BOURGUIBA SOUSSE SIDI BOU ALI,73247366,DAY
Pharmacie BACHA AHLEM,SIDI BOU ALI,"35.954524,10.583450",Av HABIB BOURGUIBA SOUSSE SIDI BOU ALI,73255455,DAY
Pharmacie LIOUANE HEDI,SIDI EL HENI,"35.681083,10.583450",SIDI EL HENI SOUSSE SIDI EL HENI,73280001,DAY
Pharmacie BEN CHERIFA RIDHA,SOUSSE VILLE,"35.824243,10.583450","23, Av HABIB THAMEUR SOUSSE SOUSSE VILLE",73224977,DAY
Pharmacie BEN MOUSSA HABIB,SOUSSE VILLE,"35.850254,10.583450","163, Rue DES PALMIERS SOUSSE SOUSSE VILLE",73274078,DAY
Pharmacie BEN SAAD SOUAD,SOUSSE VILLE,"35.838753,10.583450","Av, YASSER ARAFET SOUSSE SOUSSE VILLE",73820610,DAY
Pharmacie GRAZINA HAMOUDA,SOUSSE VILLE,"35.851898,10.583450",Av HEDI GARNAOUI SOUSSE SOUSSE VILLE,73240166,DAY
Pharmacie JERBI ABDELKADER,SOUSSE VILLE,"35.832550,10.622117",OUED EL KHARROUB SOUSSE SOUSSE VILLE,73229239,DAY
Pharmacie KALLALA MOHAMED MONDHER,SOUSSE VILLE,"35.814742,10.622117","16, Av IBN KHALDOUN SOUSSE SOUSSE VILLE",73237711,DAY
Pharmacie ZAOUI BECHIR,SOUSSE VILLE,"35.831276,10.622117",Av 3 AOUT SOUSSE SOUSSE VILLE,73224563,DAY
Pharmacie BEN OUANNES MOHAMED MAHER,SOUSSE VILLE,"35.836824,10.622117",Av YASSER ARAFET SOUSSE SOUSSE VILLE,73272735,DAY
Pharmacie CHAIEB LOUED HOUDA,SOUSSE VILLE,"35.844742,10.622117",Av KHEZEMA SOUSSE SOUSSE VILLE,73277315,DAY
Pharmacie CHEMLI BECHIR,SOUSSE VILLE,"35.82030639,10.622117",Av 18 JANVIER et Rue HAMDA SAKKA  SOUSSE SOUSSE VILLE,73223898,DAY
Pharmacie ECHEIKH HASSEN MOHAMED,SOUSSE VILLE,"35.830231,10.622117","5, Av HABIB BOURGUIBA SOUSSE SOUSSE VILLE",73201327,DAY
Pharmacie GARNAOUI MONDHER,SOUSSE VILLE,"35.835245,10.622117",Rue CONSTANTINE SOUSSE SOUSSE VILLE,73229449,DAY
Pharmacie NAIJA MONCEF,SOUSSE VILLE,"35.830999,10.622117","6, Av TAHAR SFAR SOUSSE SOUSSE VILLE",73227662,DAY
Pharmacie SAKLY SEKHIRI AOUATEF,SOUSSE VILLE,"35.833605,10.622117",Av MOHAMED KAROUI SOUSSE SOUSSE VILLE,73201839,DAY
Pharmacie BEN YOUSSEF FREDJ,SOUSSE VILLE,"35.845483,10.606627",Rue BOUKHARI SOUSSE SOUSSE VILLE,73319501,DAY
Pharmacie BOUASSIDA BENZARTI WAFA,SOUSSE VILLE,"35.842434,10.606627",Av MAGHREB ARABE - Rce BLIBANE SOUSSE SOUSSE VILLE,73270722,DAY
Pharmacie BOUAZIZ NAJDA,SOUSSE VILLE,"35.812672,10.606627","12, Rue IBN KHALDOUN SOUSSE SOUSSE VILLE",73383460,DAY
Pharmacie KSIA DALEL,SOUSSE VILLE,"35.839479,10.606627",Av KHELIFA KAROUI SOUSSE SOUSSE VILLE,73822331,DAY
Pharmacie MESTIRI FADHEL,SOUSSE VILLE,"35.853116,10.606627",Rue EL AKID EL GARNAOUI SOUSSE SOUSSE VILLE,73270335,DAY
Pharmacie NOUIRA JENAYAH SOUHA,SOUSSE VILLE,"35.829903,10.606627","26, Rue IBN EL JAZZAR SOUSSE SOUSSE VILLE",73200230,DAY
Pharmacie PHARMACIE DOUIK,SOUSSE VILLE,"35.826080,10.606627",Av HABIB THAMEUR SOUSSE SOUSSE VILLE,73224258,DAY
Pharmacie ACACHA BECHIR SAHBI,SOUSSE VILLE,"35.833796,10.606627","25, Rue LEOPOLD SENGHOR SOUSSE SOUSSE VILLE",73223029,DAY
Pharmacie BEN CHERIFA MONCEF,SOUSSE VILLE,"35.827243,10.606627","17, Av DE FRANCE SOUSSE SOUSSE VILLE",73223843,DAY
Pharmacie BEN MANSOUR HABIB,SOUSSE VILLE,"35.836089,10.606627",Av A. KADHI - LA CORNICHE SOUSSE SOUSSE VILLE,73229630,DAY
Pharmacie BROSSARD MYRIAM,SOUSSE VILLE,"35.85176,10.61389",Rue DES ORANGERS  SOUSSE SOUSSE VILLE,73277910,DAY
Pharmacie DRISS SAMIA NAJEH,SOUSSE VILLE,"35.842794,10.61389",Av KHELIFA KAROUI SOUSSE SOUSSE VILLE,73243540,DAY
Pharmacie FRIGUI HAFEDH,SOUSSE VILLE,"35.82572125,10.61389",Av IBN EL JAZZAR - Imm HELYA SOUSSE SOUSSE VILLE,73212222,DAY
Pharmacie BEN JAZIA MAHMOUD,SOUSSE VILLE,"35.848380,10.61389",Av DES PALMIERS SOUSSE SOUSSE VILLE,73242390,DAY
Pharmacie BOURAOUI MAHMOUD,SOUSSE VILLE,"35.831814,10.61389","11, Rue Dr MOREAU SOUSSE SOUSSE VILLE",73222880,DAY
Pharmacie BOUSSETTA SAMI,SOUSSE VILLE,"35.829542,10.61389","19, Rue ALI BELHOUANE SOUSSE SOUSSE VILLE",73225054,DAY
Pharmacie CHAYATA MOHAMED NACEUR,SOUSSE VILLE,"35.816230,10.61389",Av DU 15 OCTOBRE SOUSSE SOUSSE VILLE,73331563,DAY
Pharmacie DRISS HAMDENE RAJA,SOUSSE VILLE,"35.834127,10.61389",Rue SLEIM AMMAR SOUSSE SOUSSE VILLE,73820079,DAY
Pharmacie GUEMIDENE NEILA,SOUSSE VILLE,"35.817150,10.61389",Av ABOU HAMED EL GHAZALI SOUSSE SOUSSE VILLE,73235650,DAY
